,index,Unnamed: 0,Name,Gender,Time,Text
242,899,387,Speaker 5,M,01:33:27,"Whatever people can access, I guess. Yeah, but it's like a friend in the corner, isn't it? yeah. Keep it coming."
243,902,390,Speaker 5,M,01:33:46,What was that Gogglebox?
244,904,392,Speaker 5,M,01:33:49,"When I watch someone, I feel as if I'm there with them, in the chats as it were, so it's like, Oh, they're my friends. So it's kind of like a social contact in a way. Yeah, it's weird."
245,918,406,Speaker 5,M,01:35:30,I prefer face to face.
246,922,410,Speaker 5,M,01:35:43,"Hmm. I don't know, the interaction isn't as fluid. Yeah, no."
247,924,412,Speaker 5,M,01:35:56,I don't mind it.
248,926,414,Speaker 5,M,01:36:25,"Well, I got some Facebook. I've never would have otherwise."
249,928,416,Speaker 5,M,01:36:29,"Because I'm a bit phobic of technology,"
250,930,418,Speaker 5,M,01:36:49,What's the topic?
251,932,420,Speaker 5,M,01:36:57,Have you got a bar?
252,947,435,Speaker 5,M,01:40:39,"Family is a support, yeah"
253,952,440,Speaker 5,M,01:40:55,Social Connections.
254,953,441,Speaker 5,M,01:41:07,"Yeah, OK. I think technology, TV and social media are the big one."
255,954,442,Speaker 5,M,01:41:17,because we I think people watch tons of TV.
256,960,448,Speaker 5,M,01:42:56,"What about mental health in terms of if you're going physically going worse, you feel bad in your head. Yes. And then you don't feel like going out to meeting people."
257,962,450,Speaker 5,M,01:43:15,When we can't be bothered to go to the church. You know what you're feeling?
258,965,453,Speaker 5,M,01:43:26,Drugs.
