,index,Unnamed: 0,Name,Gender,Time,Text
102,167,167,Speaker 2,M,01:06:16,"And I got it with a thermal cup. So the thermal cup  will fit in there. You can buy them. Usually Because you can adjust, you can adjust the the whole, you know, the the clip on it. Um, whether they want that, I don't know. I mean, if you was a guy, I've got thermal cups mine are that old now. No, they don't overheat that much. Um, but like you said, talking to my sister last night, she said, Well, you know, I thought if we got thermal cups then you can bring it down, a lot of them got what they call them..."
103,168,168,Speaker 2,M,01:07:12,"What we're saying is, you know, like, maybe this was a sale in the courtyard. A lot of them can't bring hot drinks down. I've suggested they put the the tea and the coffee in their own cups bring it down now, Boiler Co in the courtyard. But Debbie said, No, you can't do that. Do that. I don't understand why. Well, yeah."
104,169,169,Speaker 2,M,01:09:28,I've got about anybody else.
105,171,171,Speaker 1,M,01:10:26,I didn't quite understand what this door is.
106,173,173,Speaker 1,M,01:10:50,"Yeah, I understand."
107,176,176,Speaker 2,M,01:12:21,"answerable now like the zoom. I mean, it might be simpler than the same I've never used zoom We've used a different type of media thing to use, but weren't operating now the guy who runs our mention he was operating it sometimes successfully, sometimes not. It is technical technology challenge if you like, love it laughs. The colleague I'm talking about. Well, it's. That sort of thing, if somebody said to me, Oh, you need to get on to this, you need to get on to that. That scares me. Like you say, it does scare you technology, am I going to be using computers for about 22 years and I'm still just scratching the surface. I can do e-mails."
108,177,177,Speaker 2,M,01:13:13,"I don't know what it is. I think it's a fear of the unknown. And you read about all the scams. But I mean, I can do the basics. I can send the emails attachments, I can open the emails. So to me, I can do what's important to me. Um."
109,179,179,Speaker 2,M,01:13:40,"It does for me. You know, like I say, I use my phone to do it. I've got a laptop not used for about three years. I've got a tablet. I get a struggle on that when trying to get onto the home page I need. I used to ask a friend to bring them up, saying I'm struggling come around, he sort everything out for me. I don't see him now. and the other friend that did it. And unfortunately, she passed away. So I feel like I'm on my own now and I feel really at a loss because where I live, I'm probably one of the youngest. You know, so there are some who use the internet, but mainly for shopping or ordering food online. And that's it. No, I don't do that. You know, I'm old fashioned, so I just like to, uh. I'm happy with what I can do But there were a couple of time later on when I make stuck in the house and I need to do more on the computers and things like that, and I just don't absorb it there. I do have a problem with dyslexia, but I know what the government member is."
110,180,180,Speaker 2,M,01:14:57,"To me at the moment is helpful, but there are people that have made that go insane. It's all. And I think people do struggle with it."
111,181,181,Speaker 1,M,01:15:08,I struggle with that. Yeah.
112,183,183,Speaker 4,M,01:16:20,"Maybe some people are scared by technology, including me. Some people are not like Hazel or she doesn't know about technology."
113,184,184,Speaker 2,M,01:16:31,Not as good as critics.
114,185,185,Speaker 4,M,01:16:33,"For example, I think it will become to some extent now. We don't see on the news all the hundreds and hundreds of people who are losing their life savings through internet banking. And they are."
115,186,186,Speaker 2,M,01:16:46,"Yes, I saw on the news with the eBay alone in the southwest, £25million stolen through scammers that we see in the southwest. You know, I've been ripped off. Nothing massive. The first one was about twenty five pound instead of six ninety nine. So I'm very dubious of what I go on to buy anything. And so it's very rare buying if you online, I go radiates cover for one of the residents. I'm supposed to be near to the. He didn't want to do it. He wanted me to do it. Yes, it looked the same. I was getting to the point where I was looking at the scene and I thought, I don't recognise that company name and don't recognise that company name. So I rang up my sister she said tribe from world. Don't do radiates covers, what they do, and you get special offers, so I ordered in that we've got it. So the next one he wants we'll order through the same company because we know it's genuine. Yeah."
116,188,188,Speaker 2,M,01:18:02,"No. You know, if it sounds too good to be true, then it is."
117,189,189,Speaker 2,M,01:18:30,Stairs without banisters for me. So especially without was a bit of banisters to.
118,190,190,Speaker 4,M,01:18:39,"Well, I wouldn't be without my handrails up the stairs now, and I didn't ask for. Oh, I've no reason to rub it down, but about four bypasses I've lost all my energy to having had colon cancer twice an insulin dependent diabetic. All sorts of things. And when I was last in hospital, they certainly organised at all these rails and I couldn't do without them now. But you know, I manage if but they were then and."
119,191,191,Speaker 2,M,01:19:09,"I couldn't even let me stay and I can't. I've got two options, you know,."
120,193,193,Speaker 4,M,01:19:47,"and whatever people might say about PCH. I mean, saying this year, but I found the wonderful, Oh yeah, yeah, I'm the beast and I own the property. I don't own the sort of walls and things, but that where I had a problem, they've done marvellous. The job and charge me quarter is because they have taken the bathroom and it was coming from the maisonette above mine and they spent four days with plumbers and carpenters."
121,194,194,Speaker 2,M,01:20:15,"You yeah, you don't got a landlord. I mean, it is it. I was in associations, you know, as great as I'm going to put it words, which is helpful if you like as PCH. Yeah. And I know what they like. I work for it and now give me landlords, you know, and go with being grateful to like Hazel. Yeah, organising quizzes and things like that. Our place. Um, I mean, I know that's not to do with a lot of this."
122,196,196,Speaker 2,M,01:21:29,"Yeah, I've seen that in a DIY. Big S.O.S. Big. Yes, I think we've got a lift right goes right through to where he needs it, you know? That's brilliant. So outside lifts, you've got stairs outside haven't you? and you."
123,198,198,Speaker 2,M,01:21:49,"And you can get these external ones that take you off. It's like a stair's lift, but it's external"
124,201,201,Speaker 4,M,01:22:27,"I also think it's important to appreciate what we've got. Yeah, I mean, yesterday, for example, if the gardener all day doing the gardens in the patch where I live, which is a big area with the dust bins in the middle, in a cage, and if we go up to the garden to have a cup of tea or coffee, you can do no wrong, you know?"
125,202,202,Speaker 2,M,01:22:47,"Yeah, they're not allowed to stop for tea breaks. Well, not on official tea breaks."
126,203,203,Speaker 1,M,01:22:56,Awesome. Really good.
127,204,204,Speaker 2,M,01:22:58,"Yeah. Very helpful. Even the ranges of caretakers. I know we can't I'm not allowed to come into your properties or if you need something, take it away, you can get outside your front door. The  communal , you know, and."
128,205,205,Speaker 1,M,01:23:18,And if they were to pick up steak every morning picking up the litter at nine o'clock. Wow. Yeah. Emptied the bins every couple of days.
129,206,206,Speaker 2,M,01:23:24,"Yeah, yeah. So you know, we got we do get a lot of help. It is really, you know. Well, I suppose there will come a time when I feel for it. Some people will need to move because of the environment that it may not be suitable for them now."
130,207,207,Speaker 2,M,01:23:48,"It's hard to say because we all we all have different disabilities or health. I mean, we had a lady in our class. She was totally blind. And if you're having a coffee morning or bingo after you come down, play bingo. Somebody go for one of the residents of Walton, go and bring it down and take it back up again and ..."
131,210,210,Speaker 2,M,01:25:28,Improvements?
132,215,215,Speaker 2,M,01:27:07,But it can turn to mould
133,218,218,Speaker 2,M,01:27:28,"That can affect your respiratory system, you know, breathe breathing and everything else you do."
134,221,221,Speaker 2,M,01:27:43,"Oh, yeah, so you're at you're like leaseholder."
135,223,223,Speaker 2,M,01:27:56,"Yeah, I don't know whether that's how to get things done. Yeah, there's a rent payer. I don't know, you know, but you do find that it would be hard if you to get things done."
136,224,224,Speaker 4,M,01:28:10,I've never found it difficult to get things done. I tend to put it in writing. I write a fancy letter to the little department of PCH. And I think that's better than a telephone call.
137,225,225,Speaker 2,M,01:28:21,"Oh, yes. Different landlords, again, the different levels of what they will do and what they want."
138,226,226,Speaker 4,M,01:28:29,And they've now just in the past week introduced a leasehold forum which is on Zoom. Yeah. And are you going to have a personal personal contact if you're a leaseholder to discuss any problems that might come up.
139,227,227,Speaker 2,M,01:28:56,"Yeah, of course if it's more regular. laughs"
140,229,229,Speaker 2,M,01:29:03,"Yeah. The thing I I don't use buses now, but I've heard a lot of complaints from some of the residents. The post that goes from town to 25, I think, is a one to the Barbican and the Hoe."
141,230,230,Speaker 4,M,01:29:15,You have to be fine.
142,231,231,Speaker 2,M,01:29:17,"And they went to use the normal single decker bus. In the summer they're using in the tourist bus. And then when the tourist bus comes and it's full up. Yeah, the regular people who live around there want to get to the doctors at West Hoe, can't get on the bus. Mm-Hmm. Mm hmm. And because of that, you know, enough, I think, is stupid. You don't need that. You can have the tourist bus on, but keep the 25 the normal service going instead of swapping it. You know,"
143,233,233,Speaker 2,M,01:29:50,"No, there isn't no there. So you get a lot less seats."
144,235,235,Speaker 2,M,01:30:02,"So that, you know, that's here. I mean, I don't know about the rest, about the town and other areas. You know, I know you get some areas where the bus is every half an hour, and it can be every hour"
145,236,236,Speaker 4,M,01:30:15,"You get unlucky, within five metres of my front door there's a bus every 10 minutes. The 51 or the 21."
146,238,238,Speaker 2,M,01:30:38,It  is just too many red? Yeah. laughs
147,244,244,Speaker 1,M,01:33:00,That's right.
148,247,247,Speaker 2,M,01:34:14,"we have that problem on our face. So when you get a group of people sat down just talking amongst themselves. And then somebody's phone rings. And she talked about the fact that I can't hear you, there is too much noise. People I feel like say, Well, don't stay here on your phone. Go somewhere where it's quiet. They don't. You know you're right about these hearing aids. I've heard about, you know what? I don't need them. I just don't listen"
149,249,249,Speaker 2,M,01:35:03,"Well, but is it an invisible disability? People don't notice."
150,251,251,Speaker 2,M,01:35:16,"Something I suppose I've learnt living where I live with people. We've been hearing aids and someone say, Can you speak up or or can you seat on this side to make? Because that's be good. It has to be bad, you know,."
151,255,255,Speaker 2,M,01:38:28,Some people think of ISO because  I've hearing loop in the communal room.
152,258,258,Speaker 2,M,01:39:35,"Yeah. I would worry about catching me. I've got new leg, which we only got yesterday. I worried about catching that on these walking behind me. Careful, careful. You know, like you say, if you're in a wheelchair..."
153,261,261,Speaker 4,M,01:41:25,"but what I find very helpful with cooking, particularly in the sense that, you know,."
154,262,262,Speaker 2,M,01:41:38,"One in the hallway and one in the bathroom we've got Pendants Show. We've got we've got also got wristbands, which you can use. Um, I was given a wristband. Yeah. So many run my flat number. It comes through the intercom I can answer it without getting off the chair. press it once to speak to the person you know you. Plus a second time when the doors open, which I thought it was fantastic. I'd never seen that before."
155,264,264,Speaker 2,M,01:42:43,"Some people have to pay for that out their own pocket, don't they?"
156,266,266,Speaker 2,M,01:42:49,I don't know. I don't know. I know in Marlborough how some people in the flat say
157,267,267,Speaker 4,M,01:42:56,"Mm. Yeah. But I found very useful that cooking is my oven packed up and I bought a new one. I bought a Hotpoint It cost me a hundred quid on the internet that was all. And it had this facility, which I find invaluable, and that is when I put something under the grill, I then put the timer on. Yeah, but it switched itself off. So so now where I've previously I forgot about it and it just had burnt bacon. it's not done perfectly because I know exactly how many minutes it was it switched iself off, so often they try to get carried away watching something for example."
158,269,269,Speaker 2,M,01:43:46,"We've got our alarms going off. Oh yeah, because somebody fell asleep on the sofa and that's something on the hob, wherever, you know. And it's a brilliant idea. Yeah. I mean, if I'm doing chips in a chip pan, I don't like these fryers. It's the horrible thing. I like your standard chip pan. I stand by that cooker from start to finish, then you get often. But I'm fortunate I can do that, you know, again. So it's hard for me to say what barriers may come in front of me that 20 years."
159,271,271,Speaker 2,M,01:44:46,I might be able to draw a line at low
160,273,273,Speaker 2,M,01:44:51,"I haven't got the manual for it and that was given to me. If you're two years old and it was given to me, and so I would give it to you from the air fryer to a proper conventional cooker, which I've always liked. So I don't know whether it was this guy. I know it's got a timer on running for the oven, whether it's for anything else on that, I don't know. I can probably download the manual for it. Oh, I thought you was saying that."
161,275,275,Speaker 2,M,01:48:38,"Can I think something? It's not my it's been a relative inclusion actually. Having come to me, ask me, I have no idea that, you know, when you're saying you need to say your GP service? Yeah, go username, password. Yeah. And sometime in which is going come into a password not recognised and it and then you should turn out. Her son checked her computer it wasn't her computer, it was a GP sensor, it was. There is a code and she couldn't get through to a doctor and she needed medication urgently nebuliser, you know, um, I've never used mine since it went online. I've never used it. Not that I don't want to. I don't even know what the website address is, so I have to ring them open. Ask them where you can get through. Um, that's the problem. You know, technical stuff, folks, and stuff like that. If the system's going down. Yeah. To Ringo, oh, you'd have to try again tomorrow. Love to try again tomorrow. An actual person, you could be dead by tomorrow. You know, I mean, not everybody knows it when you're feeling unwell, it's life threatening. Yeah. And you're ringing the GP because you don't want to bother your neighbours."
162,276,276,Speaker 4,M,01:50:04,"The other thing is, the older we get, I think safety is very, very important, you know? Yeah, I when I moved into my place, I bought myself from the re-use centre in Union Street, a tumble dryer. I paid ten quid for it. Yeah. And I got it home and it worked. I look on the internet and it was suspect to fire. Yeah. So I ran the Whirlpool and I said, Look, I've got a tumble dryer of yours and you say it's one of the other risks. So they said that's all right give me the serial number, and within two weeks they did bring me a new one."
163,277,277,Speaker 2,M,01:50:38,"Oh, that's fair enough! laughs"
164,280,280,Speaker 2,M,01:50:50,"That's right. Are a lot of time. You've got to go on the internet to find the phone number so. Yeah, it does happen. Yeah, I got news. I bought a scooter that can run from better life. Yeah. Lloyd's chemist used to sell,"
165,336,54,Speaker 7,M,00:18:25,"Get to the airport, put my case in, next stop. You know, the bark."
166,338,56,Speaker 7,M,00:19:16,"Gardening, yes."
167,340,58,Speaker 7,M,00:19:31,"She was fine. she was all right. I mean, the first plant landed upside down"
168,351,69,Speaker 7,M,00:22:38,"Well, sometimes you get, you know, a bit negative. Yeah, I like to say something serene. You know? Yeah, like I said, that is it. Right? Well, yeah. You know that all these, you know?"
169,354,72,Speaker 7,M,00:23:00,"Yeah, just get him off the chair and just sit outside in the fresh air saying, try it now, but I've tried to say, man instead of me doing it today, you do it. You know? But he's afraid of falling over. The guy fell over several times and of course.."
170,356,74,Speaker 7,M,00:23:29,Got in touch with the right people? Yes. To one another. Yeah.
171,359,77,Speaker 7,M,00:24:00,"He's been so independent because, I mean, he was he was in the Marines, but he's been so independent and helping other people before he needed himself and he doesn't like it."
172,369,87,Speaker 7,M,00:43:30,It works both for and.
173,371,89,Speaker 7,M,00:43:46,We never know. Laughs.
174,377,95,Speaker 7,M,00:45:03,"And this is often very, very commonly when we call our GP. It's so difficult to talk to your GP, I mean, you just end up in these terrible menus."
175,407,125,Speaker 7,M,00:55:11,"The only danger I can see is crime. Crime is a lot, isn't it?"
176,432,150,Speaker 7,M,01:04:58,They don't have taxis today from community aims to begin
177,434,152,Speaker 7,M,01:05:03,"No, that wasn't the taxi, that that was a human error."
178,451,169,Speaker 8,M,01:10:49,That's a difficult one.
179,455,173,Speaker 8,M,01:11:24,"Technology, stairs and trip hazards"
180,485,203,Speaker 7,M,01:24:32,You've got some undesirable people in our block.
181,506,224,Speaker 8,M,01:32:16,"The deliveries, delivery services, as a negative, because they don't bring it all the way up the stairs."
182,516,4,Speaker 5,M,00:03:58,I live with a partner on one cat.
183,519,7,Speaker 5,M,00:05:11,"Yeah. I don't think I'd mind because if I feel that I need help with somebody around in case something happens to be, I feel bad for somebody with. You know, if that was something someone was knocking every day or checking, if I'm OK."
184,521,9,Speaker 5,M,00:05:30,Are they?
185,528,16,Speaker 5,M,00:07:01,I'm shaving less often.
186,534,22,Speaker 5,M,00:08:41,Tapioca!
187,543,31,Speaker 5,M,00:11:19,"I like gardening, so I'd like green space to look after when I'm older. Feed the birds and stuff like that."
188,548,36,Speaker 5,M,00:12:45,"Walking, I like countryside walking."
189,552,40,Speaker 5,M,00:12:57,It's not that flat in Plymouth by the way.
190,566,54,Speaker 5,M,00:16:27,I guess it's the mental distress that it causes. Isn't it ? when you can't do what you were used to  maybe ??? with life? Yeah. You know.
191,590,78,Speaker 5,M,00:20:40,"And I think it'd be quite nice. I mean, people do things for you."
192,591,79,Speaker 5,M,00:20:45,"yeah, I won't mind."
193,593,81,Speaker 5,M,00:20:52,I just give them more jobs.
194,615,103,Speaker 5,M,00:25:11,"Yeah, I've seen it right. I enjoy a good book or good films. I just noticed reading that I really enjoy a good book or watching a good film."
195,619,107,Speaker 5,M,00:26:44,"Yeah, I'll make rude comment"
196,622,110,Speaker 5,M,00:27:27,"Yes, yes. You know, regarding the car accident, you had to."
197,624,112,Speaker 5,M,00:27:54,A few of us mentioned walking.
198,629,117,Speaker 5,M,00:28:38,"Cooking is fun, isn't it? because you can look forward to eating after that."
199,634,122,Speaker 5,M,00:29:27,"I think I have it for granted in a way, but it's taken away. Yeah. See if you are alone for the week."
200,656,144,Speaker 5,M,00:34:26,"Well, isolation was used in prisons as a punishment, wasn't it?"
201,657,145,Speaker 5,M,00:34:33,Oh yeah. So you'd be locked on your own.
202,659,147,Speaker 5,M,00:34:45,"And I think there was a study made by a bit of a cruel statistically, but I think they did it with cats and the cats would be happier if you had any kind of contact, even if it was negative contact if it was just hit. Kind of thing, rather than stroke, it would be happier just because of the contact. So they were saying, well, that could be sort of people as well. Yeah. So just bad, any contact was better than nothing at all which is weird."
203,660,148,Speaker 5,M,00:35:34,Very important! Laughs..
204,665,153,Speaker 5,M,00:36:28,"Well, that's where you got all the guts??? Said, which is great things you wouldn't say in the office."
205,667,155,Speaker 5,M,00:36:46,"And you get to learn about all the teams because suddenly we're going to talk of the other teams in the organisation unless there's a meeting or something or something formal. So, yeah, so you get to know what's happening in their little neck of the woods."
206,672,160,Speaker 5,M,00:50:38,"Yeah, yeah. There's a can opener??? Which is really good. Yeah."
207,677,165,Speaker 5,M,00:51:28,You could put the light somewhere else?
208,683,171,Speaker 5,M,00:52:49,A lack of money could be a barrier.
209,685,173,Speaker 5,M,00:53:23,"You've got to qualify, I think. Yeah. And then social services would help you."
210,694,182,Speaker 5,M,00:54:22,"And it's knowing that that help is out there as well, because you may not know that you could get help. Yeah. So it'd be nice if somebody came to see you and explained, Oh yeah, you could have this, you could have that because I'm sure a lot of think lots of older people don't claim certain things today and that they're entitled to."
211,699,187,Speaker 5,M,00:55:18,"Yeah, yeah, yeah. Well, she's paid all her life social insurance. That's what it's for, isn't it?"
212,710,198,Speaker 5,M,00:59:08,Especially with clothes because you want to feel them and try them on.
213,718,206,Speaker 5,M,01:00:03,Look for the bargains.
214,723,211,Speaker 5,M,01:00:48,They don't always give you the very thing either.
215,725,213,Speaker 5,M,01:00:55,"It's the same colour..Laughs.  Yeah, yeah."
216,736,224,Speaker 5,M,01:02:57,"Yes. Knowledge. Would it be big for me? Knowledge knowing? Yeah, yeah. Information?"
217,737,225,Speaker 5,M,01:03:04,Yeah. So it's something you haven't heard about
218,743,231,Speaker 5,M,01:04:07,something like 65.
219,753,241,Speaker 5,M,01:05:22,Transport.
220,757,245,Speaker 5,M,01:05:38,"Oh, I see."
221,762,250,Speaker 6,M,01:06:08,"Maybe the mobility? Yeah. Mhm. Yeah. Like, moving yourself and also transporting things. So it's more like for mobility. Yeah. Yeah."
222,764,252,Speaker 6,M,01:06:27,"Yeah, something like this. I loved the whole knowledge that you guys talked about because this is something that's not exactly physical. It doesn't fit anywhere, but it's just amazing. And I think that that's something we need to think about."
223,768,256,Speaker 6,M,01:07:10,An information centre.
224,770,258,Speaker 5,M,01:07:26,"Because it's always something you learn like, Oh, I didn't know. But even now in my job and I should know what's out there, mostly. But that's always something I think I've got to know about that."
225,790,278,Speaker 5,M,01:10:51,"They are company, aren't they?"
226,793,281,Speaker 5,M,01:11:32,something to worry about.
227,795,283,Speaker 5,M,01:11:53,When did she die?
228,797,285,Speaker 5,M,01:11:57,Oh yeah. Are you going to get another one?
229,799,287,Speaker 5,M,01:12:05,Just take on home.
230,811,299,Speaker 5,M,01:13:56,"Yeah, it comes with adaptations."
231,812,300,Speaker 6,M,01:13:59,"It's a very broad categories, so..."
232,820,308,Speaker 5,M,01:15:16,"no. It's nice down there, isn't it?"
233,824,312,Speaker 6,M,01:17:14,Is it a shared table  or something like that? I don't know.
234,834,322,Speaker 5,M,01:20:20,"I was going to say often it's we compared to China you know, where the culture is different, where the elderly are more respected. I mean, we don't live in the same house. Yeah, there is more social connections. Well, in Britain, we've lost a lot of that in the last century, I think."
235,843,331,Speaker 5,M,01:22:35,"It's kind of interesting stuff, you know, you just got to try  once you're older, you know, like, you know, well, maybe somebody younger. Yeah. So maybe not so valued."
236,847,335,Speaker 5,M,01:23:42,You need to put your foot down.
237,854,342,Speaker 5,M,01:24:36,"Because it's a big social thing with Facebook and stuff now. Yeah, yeah."
238,875,363,Speaker 5,M,01:29:48,"Unless she missed it, you know, because you are told so many things anyway and you can't remember everything."
239,884,372,Speaker 5,M,01:30:38,"I'm thinking about social groups as well as clubs, and there is like something holding people back like all that's not for me. Oh, that's not my kind of thing. Well, in fact, if you were to go along with it, make new friends and probably have a laugh. Yeah, and it would be generally, good, good for them. So I think people should be encouraged to do more."
240,888,376,Speaker 5,M,01:31:36,"It is creating the family, I suppose, isn't it?"
241,896,384,Speaker 5,M,01:33:12,Like the TV is a big social friend for people as well.
