,index,Unnamed: 0,Name,Gender,Time,Text
0,0,0,Speaker 1,M,00:00:40,But my thoughts were to learn about technology now learning more about technology.
1,1,1,Speaker 2,M,00:00:50,"Um,. I'm not crazy technology, computers, even phones. I use my phone as a computer. I've got a laptop and a tablet about the use of make things right. So, um, that was it, really. And then I thought, Well, we'll learn something today."
2,2,2,Speaker 2,M,00:01:21,Yeah.
3,3,3,Speaker 1,M,00:02:04,"Very. And yeah, yeah."
4,5,5,Speaker 2,M,00:02:31,"It's about different disabilities in one way or another. Looking at the less on the forms so that was 50 percent of where we live. People has got different disabilities. Some people we see struggle and when I became disabled I thought, well, I could get worse as I got older and yeah, I want to be able to stay at home. You know, I don't want to be living in fear of people who live after me, or not being able to do things for yourself. And I think we all feel like that, you know?"
5,6,6,Speaker 4,M,00:03:10,"So that's the reason I came. I love my home. Yeah, I love where I live with my home is, and I came here in the hope that I can learn to stay there as long as I can. And I'd hate to be in a residential care home, for example. It just would not be my scene."
6,7,7,Speaker 4,M,00:03:36,I managed to be.
7,11,11,Speaker 2,M,00:04:04,My memories of being one's own boss. Yeah.
8,13,13,Speaker 2,M,00:04:29,"it's that you thought correctly correct? You remember, Bill? Yeah, he's in a care home and he is happy enough. But he's he doesn't see anybody. How come the people in and he was running a video of where we live? He was the light of everybody's life in the, you know, he knew everything about the Barbican and everything he could tell you. He's in his 90s. He could tell you everything. And he was always pleasant to listen to. Um, when you went to a care home, you didn't see a lot of people in the building. You got a coffee mornings when you got down, you know? And so he's got more commonly where he is for each of missiles. He misses his family because they all live north and. To me, I couldn't live like that. You know, so,"
9,15,15,Speaker 2,M,00:08:16,"daily activities, yes, it is"
10,18,18,Speaker 4,M,00:09:28,"It's little things that concern me to some extent, I mean, for example, one thing that concerns me is actually having a show of. Now, at the moment, with great difficulty, I might add, I can actually stand up in my best, but it's not easy to actually cross your leg over wow and stand up, but the council have put handrails, so you know, OK, hang on to them and I really appreciate that because without them, there's no way I could get into the best and little things like that I really appreciate. And I just wouldn't like to smell too much."
11,19,19,Speaker 2,M,00:10:19,"Yeah, I have a wheelchair. Yeah, which looks like the standard of the big wheel. Yeah, I have that in my shower room, so I transfer from one wheelchair to another looking out in the shower. I don't like it I would prefer to stand up. I've got bad shoulders and from trying to get the showering 100, you know, and you don't feel like you clean yourself as a proper boy but it is better than a bath. When I lost my leg, I was given one of the chairs a rise and fall from Millbrook. And that was great because then I could just raise myself up turn around the chair and put my feet down. That was from the bath. So I don't know if you've got one of them."
12,20,20,Speaker 4,M,00:11:08,I've got an ordinary bath
13,21,21,Speaker 2,M,00:11:10,ride to call when you put it in your bath.
14,22,22,Speaker 4,M,00:11:13,"Oh no, I got nothing in the bath except the best mate drive"
15,23,23,Speaker 2,M,00:11:29,"Yeah, I didn't know they existed till I got one. Yeah. And I thought. And anybody struggling to get in and out of a bath of bullying about slipping falling in the bath. I mean, say we really, for me, a period in my confidence that started off with a bench going across the bath and I nearly went headfirst into the touch. And so I was at seven. Not we're not going to forget, you know,"
16,24,24,Speaker 2,M,00:11:59,"that period of time where we moved when I moved to now. Most of us got wet rooms. I think there's only one fly out the 34. It's got a bath. And their ideal for us, even if you only want a walking yeah, like I say, I was given that wheel chair just sat on that and it is quite comfy cushions say, you know, it's great."
17,25,25,Speaker 2,M,00:12:47,Not for me?
18,26,26,Speaker 2,M,00:13:01,"Yeah, that that bothers me because I have neuropathy means so don't feel heat straight away. Um, when I moved back in, I'm now four years ago, I was in a wheelchair. I'm in my bedroom. Very rarely wore it. Don't do this impression, but the important hello worked for me. I didn't have open air fryer and a small hub that was great while I was in the chair that was worried about leaning forward, bending down to get to the Oven. And even now I can bend down. Sometimes I can lose me balance, so it didn't bother me. And I think as I got older, personally that does concern me. You know, I've I lost me there like that. Be it, then I wouldn't be cooking takeaways. Yeah."
19,27,27,Speaker 2,M,00:14:00,I like talking!
20,30,30,Speaker 2,M,00:14:27,"Oh, there will be no look area,."
21,31,31,Speaker 4,M,00:14:40,"Transport is probably one chance for trying to get in and out because they can't use buses or taxis because I have difficulty trying to get into a door had trouble getting your car, you know? Yeah, and quite tall. Not quite as you bend, I've got back and hip problem. I can't kind of move properly. It's difficult with me. So is transport is a an issue."
22,32,32,Speaker 1,M,00:15:06,"I'm glad you mentioned that because transport will be the top of my list. And the reason being that as long as I can get on a bus and I can celebrate it in a bus stop, I can see my children and one lives in Launceston. One lives in Woodbridge and two and a half hours on the bus. But the only problem I've got with buses are and get on the bus at the moment and get off. But. I've got a hopefully I can manage without a wee until I get to Bodmin."
23,33,33,Speaker 1,M,00:15:40,pretty soon because it stops them enough above me for me to get out and have a pea that I've got to tell you this too.
24,35,35,Speaker 2,M,00:16:19,"Yeah, I've already mentioned we're right. Yeah. You know, I've been since, you know, legally here."
25,36,36,Speaker 2,M,00:16:30,"It's no, definitely not. But um. I think it's a good way of being in contact with people in families. I know it's nice to be together, but with everything we've gone through, you know, on Zoom or other social media, you can be your messenger through Facebook and it is good you can see your family talking to, you know, um,"
26,38,38,Speaker 2,M,00:17:10,"thinking, Oh yeah."
27,40,40,Speaker 2,M,00:17:24,"I struggle with it when I thought I had to isolate, because that meant taking early last year was to say isolate for 14 days. I struggled to quell my scooter to try to avoid everybody. Well, no shops open in town show free travel around there, but it can get scary as well. And I think I'm more scared now than it was last year, and I think it's because of the understanding of it about both the Jabs obsessive test yourself twice a week. But we have a great community where we live. We're lucky, we're very lucky, and we all realise that, um, we had nobody had the infection or anything like that, you know, the virus. So and we do sit downstairs. I'm not in the community when we weren't allowed to use that, but it's still sitting in the main entrance. You know, I don't"
28,41,41,Speaker 2,M,00:18:23,"do or out in the courtyard, you know, so we had the communication wasn't too bad for us. But if you look what your own in your own house and I think you're more isolated than I think communication right through technology is in really, you know."
29,42,42,Speaker 1,M,00:18:43,"When some people can't drive a car, that's how you do notoriety before then. Once you try to ?  During lockdown I was stuck for two years. Yes. We just live in a bedroom and that's it is a shared house for four people. And I wouldn't go see it."
30,43,43,Speaker 2,M,00:19:09,"And I just don't think even though we've got a community, we do face to face just in our reality now. You know, while they are still things like, do they really, I don't know what we would have done 40 years ago. I really don't, you know, so"
31,52,52,Speaker 2,M,00:22:44,"They've been very good press so of. I mean, I'm not with them, but some the our residents are yeah. And you know, I mean, that struggle. I don't even have to pay for my prescriptions. I got a text message from Boots's chemist because of pain and your prescription is ready for collection and closes the book. The booth came back only 10 minutes, you know? Yeah. So our customer, so we've been lucky like that."
32,54,54,Speaker 2,M,00:23:16,"But I was with Lloyds in Devonport. Then when I moved, I told my doctor that my prescription is going to Boots. And at the start, I had to keep ringing up, ringing up, getting prescriptions that over now Boots supply for it, for me."
33,56,56,Speaker 2,M,00:23:38,"We won't now go back four years ago. You know, these are driving where we have all agreed for, you know what I need from when they need it. So, OK, OK."
34,58,58,Speaker 2,M,00:24:00,"I forgot how my Doctor looks like,."
35,61,61,Speaker 2,M,00:24:09,"and you know, especially with the chest problem, and it's a bit of a telephone consultation. And when I say it's a consultation, a conversation because you will only be hearing huh huh down the phone ..."
36,62,62,Speaker 2,M,00:24:23,from the phone down and you prevent even breathe.
37,65,65,Speaker 2,M,00:25:30,"Yeah, I do get annoyed, really, don't you all?"
38,67,67,Speaker 2,M,00:25:35,"Yeah, it is very hard for trying to communicate concretely for people. And I think that's where you get fed up. And I think some people just give up to try to communicate with them. The next thing to get electricity, to know why you're doing this, why are you doing that? And again, people get put under pressure. Well, you know, it's it's horrible. Yeah, it's I'm quite fortunate I do get your scam calls, you know, text messages from my provider BT. And if I'm not sure I ring BT up, you know, saggy pants and stuff like that, you know so well, a lot of people don't know how to do all lot, you know?"
39,68,68,Speaker 2,M,00:26:24,"I read about after quite a lot of our residents doing jobs for them and things like that. It's something in my nature. I would reward myself and I used to work for, Yeah, and I still do it now. You know, that's what keeps me going mentally. You know, without all that I don't know, I'll be there enough income of our party, you know?"
40,70,70,Speaker 2,M,00:27:22,"Yeah, that's it. Yeah."
41,72,72,Speaker 2,M,00:28:07,"to do something very plausible, the people very and I sometimes tell our residents like I've had this scam call, if you get a scam call or they're asking you to BT again, we say my payment last month hasn't gone through and they take my details. Well, I've checked my bank statement. I know that it was paid, so I didn't have to do anything else. I just blocked the numbers. But they come back with different numbers"
42,73,73,Speaker 2,M,00:28:37,oh they did
43,74,74,Speaker 2,M,00:28:38,"So it's it's never ended, and I don't think it will stop the way we're going to stop it."
44,75,75,Speaker 4,M,00:28:48,There is a way for these big companies don't want to.
45,76,76,Speaker 2,M,00:29:10,"You can't keep. Yes. Yeah. We have agreed to our place doing Taichi every Monday afternoon. I start doing it with them well, so a lot of them, our regulars, that they drifted off along with what your you can't be with the big group and this group called the Barbican legends, which there were a lot around the Barbican. They were coming in, doing this Taichi. It is very good for you."
46,77,77,Speaker 2,M,00:29:41,"And it's a great way of being able to meet up with people. But at the moment it is not right to do. Um, I think they started it again and"
47,78,78,Speaker 2,M,00:30:01,"Yeah, for now we can't."
48,79,79,Speaker 2,M,00:30:09,"That's right. Yeah, yeah, yeah. Yeah."
49,80,80,Speaker 4,M,00:30:12,"So if I can just just go back three spaces. Somebody mentioned television licences. Now there's no getting away from the fact that television is very important to elderly people who are confined to their own home. Yeah, now I'm 82 soon be 83, and I've got a TV licence because they stop the free ones. And this week, for example, I got a message to renew my television licence, and I haven't done so because I got so annoyed that the millions and millions of people have not even done last year's licence. And yet, so I think because it's so important that elderly people have the facility legally to watch television, it ought to be sorted out."
50,81,81,Speaker 2,M,00:30:57,"Yeah, I get mine to be renewed every year automatically, and I don't know why, because by the people I to."
51,82,82,Speaker 4,M,00:31:06,"I don't mind paying, but I do expect other people to expect other people to pay."
52,84,84,Speaker 2,M,00:31:17,"The repeat programmes, you could expect a double bill for your licence."
53,85,85,Speaker 4,M,00:32:28,"Well, we'll just make one comment on digital communication. I didn't actually comment when it was discussed. I use a zoom, a great deal and sometimes that as many as 400 people can go on Zoom sessions from around the world little corners of the world had never heard of."
54,86,86,Speaker 4,M,00:32:50,How do I use it?
55,87,87,Speaker 4,M,00:32:57,"I use it for groups of which I am myself a member and the worldwide groups, and I use it for church activities, which I am a member. And I also use it digitally for communicating with my children with a portal, which is a magic machine. I just make telephone calls by saying to the television, Please ring Harry and Harry's on the television."
56,88,88,Speaker 2,M,00:33:28,"I also wondered about that one. Well, I'd probably get it for my family. Well."
57,89,89,Speaker 4,M,00:33:32,"So having said that, I'm not keen on it if I think about it deeply because it really does eliminate social interaction. Person to person, yes. So although I'm spot on a bit of a coward in a way, I use it. But. The back of my head says I don't really agree with this."
58,91,91,Speaker 2,M,00:34:07,I would say the pope was there on a big TV screen. You can see the state that was behind the screen and completely look like you got real bad luck.
59,92,92,Speaker 4,M,00:34:19,I only got this because one of my kids bought it for Christmas.
60,93,93,Speaker 2,M,00:34:22,Yeah.
61,94,94,Speaker 2,M,00:34:24,"No, I think I said digital interaction. Um, communication is important, but there are still a lot of people that don't have that. They don't want to. You know, I'm. I got it for just over two years, and I'm still scratching the surface with it, um. People come to me and ask me. Because so wrong when we computed hello. No, but your son can work for the education services on I.T., you know? So, um, I'm more a practical person."
62,97,97,Speaker 2,M,00:36:29,"Do you think that a lot of people think a realise that you know about self-care, that is important"
63,100,100,Speaker 2,M,00:36:44,"same as activities, you know, even though it's essential to you. You know, I've got to have a bath. It's an activity or a shower. You know, it's an activity."
64,102,102,Speaker 2,M,00:37:01,"People say to me, Always enjoy what you do or enjoy doing what you do. I have got saving for life, and I'm fortunate to have that. Um? Well, so, I've seen people that hasn't, you know, people"
65,107,107,Speaker 4,M,00:38:30,"But I think the transport as a part of social interaction is vital. I mean, for example, I've got a son who's a copper in Launceston. Yeah. Now I'm going to hop on the bus right outside my door. No one from here to those tables that hop on the bus and I get off at Tesco's in Launceston, which is eight minutes for my son, he collects me in the car. Yeah, I'm just starting to get some of the best of Tesco's naturally, but"
66,108,108,Speaker 2,M,00:38:59,"then I'm fortunate I've got a car hold beloved for. I don't know what I do generally road some of the residents around to the garden centres that help yourself, you know, so I've got no taxis but waste money on taxis, you know that. So I enjoy getting out excuse to get out. And so that is important to me."
67,110,110,Speaker 2,M,00:39:27,"Yes, you are."
68,112,112,Speaker 2,M,00:39:50,"Yeah, yeah. Is there any approximation when you crashed on the bus I worked with was comedy, a nightclub, three buses in the depot."
69,113,113,Speaker 2,M,00:39:58,"So I burst in because the crowds in the way that I went because it felt I felt pressured to do that and put the post goes quiet because I do like to use to drive. I do reverse parking and they'll go, Oh, you know, the flashing to the side? Yeah, something out."
70,114,114,Speaker 1,M,00:40:19,"I don't know his picture post. You can't, you"
71,115,115,Speaker 1,M,00:40:24,"know, it's a self-drive 'cause people make up, they go off, right? And I had two arguments to have taxi drivers in Plymouth but I didn't hear. He started giving me a lot of, you know, doing that and I'll get off an engineering and technology made.You would think a lot about Typekit. I think more people are going to get hit by a car, but yeah,."
72,116,116,Speaker 2,M,00:40:48,"They are know what you're saying, but it's all about climate change and people have to suffer with climate change and not just because of climate change. Electric cars, like you said, they're very quiet. I've never stepped out looking the wrong way, but you know, you don't ever call me, you know, so there's no"
73,124,124,Speaker 4,M,00:42:44,"But it was a complete idiot or not. One thing I miss is my driving licence and I can't drive. And I just let it lapse, like living in France and Belgium, and I didn't need one because this is I just never one of  ..."
74,125,125,Speaker 4,M,00:45:26,"Yeah, we're getting my driving licence back. It is not impossible that they have a point because I'm insulin dependent diabetic and had four heart bypass. I have cancer twice. They take all these medical things into account. And because you're over 80 years , You wait for years to get your driving licence, which is really going to make it hard to just renewed your degree and wouldn't have any problems in this country."
75,126,126,Speaker 4,M,00:53:19,"When you think of how the world's changed in the past 80 years, it's just a man. Yeah, and frightening."
76,128,128,Speaker 2,M,00:53:29,"see these films that come out, you know, robots."
77,129,129,Speaker 4,M,00:53:41,"But a very Victorian upbringing wouldn't even have electric vehicle guests if that oil lamps, no wireless or anything like that."
78,130,130,Speaker 2,M,00:53:53,"it's kind of my generation now. You know, I mean, I can't imagine having a television since I was a toddler. But when microwave was coming you give me pause and think that now you feel like I can't give me that one?"
79,131,131,Speaker 4,M,00:54:11,"Well, my wife wouldn't have one she wouldn't use it to get the room microwave oven."
80,133,133,Speaker 2,M,00:54:19,"Well, I think we read you talk about radiation and not what you think. You find that you know what's going to happen."
81,135,135,Speaker 4,M,00:54:31,"So I went to my well, I spent most of her time in the spinning wheel to yeah, yeah, straight on the spinning room. And she was very well as well."
82,136,136,Speaker 4,M,00:54:41,"And frankly, that was"
83,137,137,Speaker 2,M,00:54:45,"in an antique shop in the day and the end of the old toys. You know, and it's just like this spring on it and this little bobbing on it, you know, it was kids entertainment. Then, you know, and then you try and get a kid now like you one of them night that five year old knows how to use a computer about the knowledge. And it's. Oh yes. So I do have dyslexia, you know, so I struggle with things and not very retellings have to be told this is what you've got to do. Something finished telling me I've forgotten the first part. You know, so I don't know what going to be like in seventy years. I've no idea."
84,138,138,Speaker 2,M,00:55:50,That that scares me. I want to run a self-drive car sitting in a car andI can't control the steering wheel which is moving along the motorway that terrifies me. I like to be in control.
85,139,139,Speaker 2,M,00:56:09,"Well, we are in a way because we, you know, somebody at the front and control. You know that because that is"
86,140,140,Speaker 4,M,00:56:18,You don't know that on the docklands light rail that drives itself.
87,141,141,Speaker 2,M,00:56:30,"Yeah. And when you talk about planes without pilots, I mean, I won't even go on a plane anyway, you know, with the pilot"
88,144,144,Speaker 2,M,00:57:02,"If I get in the left hand drive car. Yeah. Even though I know so many drive, you know where I'll be banging my feet on the floor when you go to a break and you just instinctively think you've been driving for a long time. Yeah. And I mean, even get my car out of an adapted factory to be left for the accelerator and the brake, and for 40 years I've been driving."
89,146,146,Speaker 2,M,00:57:31,It was easier than I thought.
90,148,148,Speaker 2,M,00:57:37,"What I did before I got the car, I got in touch with a driving school that caters for disabled people. And when I got in the car and I said, Look, I'll be driving this in seventy nine, I said. Now the problem, do not say anything about my driving this bad. Tell me, but I don't want to be criticised, you know, because you have old habits and drive you driving your own way. And I was a bit edgy, $40 a throw, and it was only a tiny little car, you know, and I thought, I'm going to do wheelies and I brake I brake too sharp, so I have to concentrate on that. Then the car got the Nissan Qashqai sitting in there. It looks massive extra to get it. OK, now driving that for a couple of weeks, I was nervous. Is that on the road? Because trying to get out of style where I live onto the main road and I'm waiting for traffic to grow. I've got a gap and I just hit it slightly too hard. We're spending trying to get out, but now no problem."
91,151,151,Speaker 2,M,00:59:26,"Yeah, I've done that. Come up, take Pulling away the automatic changed gear."
92,153,153,Speaker 2,M,00:59:40,"it was the first time I drove an automatic car. Not adapted. Yeah, not a standard automatic car wasn't concentrated as it pulled away before it went to the clutch. I hit the foot brake. Yeah, I mean, by the way, through the windscreen fortunate to the seatbelt umm"
93,154,154,Speaker 2,M,01:00:04,"Oh, well, then you go on that. Yeah, it was just  you're naturally link stink when you're driving. In some betting. You can just get in the car. You don't think about anything. You can get and off you go, All right. And again, with all that I'm going off to Manchester in a couple of weeks. Yeah, I've never been further than IKEA Exeter and looked a bit nervous on the A38 driving fast I don't know why. I mean, there's going to be in Manchester I don't know how how many times it's just one go basically."
94,156,156,Speaker 2,M,01:00:55,"Yeah, well, I've got mobility scooter that I use in town quite a lot you know, but I'll throw in the big free cash flow and."
95,157,157,Speaker 1,M,01:01:04,I've got an ability scooter as well. Things I don't know. I would have come on that today ...
96,158,158,Speaker 2,M,01:01:17,"Well, that's it. I've got daily fit to motorbike change. So when I finally managed to keep my scooter outside anyway, I'll change it off. yeah. even if it just showed a sign outside the shop that changed to that, you know? Yes, I've been very fortunate to have the ..."
97,159,159,Speaker 2,M,01:03:28,"The other robot brought was a cat. It was a cat seating on your lap. We have to right be outside TG. This is nine to nine this is not what the carer describes it's coming back...She wanted to buy it. So she wanted to buy it. That was a hundred sixty pounds. Other robot like this you did with Astro came in and said...Well, she locked the cap and she wanted it to buy it. And she says to Hazel I've got the money here and I'll give you the money  laughs it's safe to. They give it to Eric. He can sort it...laughs"
98,160,160,Speaker 4,M,01:04:17,"I know, a bit of a dinosaur. I'm quite frightened for the future over there. Well, I think technology has advanced far too rapidly."
99,161,161,Speaker 2,M,01:04:26,"Well, I think that's probably where a lot of people struggle with it. Either don't do that and I don't put PCH a big grade with doing the computer courses where they but there's a lot of places on the dome, but you got to pay to go and it can be very expensive. So,."
100,163,163,Speaker 2,M,01:04:54,"No, no. I mean, I always felt well, not always but recently the PCH felt a bit get a bit too controlling over us now. Yeah. When the rules change because of covid, we don't get told until a month after and we have a lot of us are desperate to get back to the coffee mornings and the bingo afternoon we can use the community room. We can't just use the kitchen. And I said, Well, Bring your coach down for tea and coffee, you know? And I'm borrowing a cow out in the courtyard. Oh, OK. A lot more can carry hot drinks on their own, you know, so they I got so oh, you can't do that."
101,165,165,Speaker 2,M,01:06:09,"Yeah, right. I've got a cup holder which clips up the week and the wheelchair."
