,Tweet,Anger,Depression,Fatigue,Vigour,Tension,Confusion
105,"I just said about physical places. And I have to say it's a criticism of the university. Where I live my home, I can only live one door away because threshold strips. Mm. Yeah. And I'm talkative I couldn't get out of the kitchen,  because the designers need to think, of, this is my soapbox. There are too many able bodied designers designing for disabled people. Yeah, they need to sit in a wheelchair and go round themselves. So that's just my soapbox that it might be. What I have come today. I had a real struggle to find somewhere to get to get in and to come out of the and the Cafe out the cafe. Yeah. You get to live with that. Yeah, yeah.",0.1527006,0.35379636,0.32896876,0.07758982,0.0693853,0.017559169
106,"A  big thing for yourself, I'm looking at the factors you're looking at, for me to stay there what was said to me recently? It's all right. The fire brigade will get you just get over the threshold to stand outside. So that way gonna happen. It's something that I'm fighting at the minute. Yeah, it's a big issue. And it might has been adapted for me, both ongoing and there's a few blows. This is the same. It's not only once inside, it's getting in and out, which is also an issue, and you've got stairs and stuff and something you can't get out it's something you never get over. But whereas I would have thought reasonable to adapt or to adjust, and that is a reason to stay where if I would have to move, I'm lucky it can be done. But there are places if you want to stay in your own home, there has to be a way of making from this part of accessibility not only in where you live, getting in and I'm sure that that makes sense.",0.90388805,6.019372e-05,0.00048880966,7.9372854e-05,2.1879189e-06,0.095481396
107,"I'm working on this at the minute,",0.113653794,0.17891833,0.37062806,0.011270089,0.15645008,0.16907965
108,"That's well, first, that comes back to self-care, but well to tell you when someone says the word, isn't it? You go, Oh yes, to stay where I am, if I have a problem, if I do well enough to comfort me, rock, as you say, get to know me. If I fall there is a technology, I can get home. But without that, you didn't have somebody like that who taught me that's have to go the care home.",0.43112,0.545229,0.0073668095,1.5540994e-05,4.8210286e-06,0.016263813
109,"It's not too bad. It's not cheap, I used to pay.",0.22705036,0.64851844,0.007735626,0.0107048405,0.0074986555,0.09849209
110,"My hob, every ring on my hob I can set a timer on and it would go off.",0.5057557,0.3572445,0.024753049,0.0008826388,0.08112684,0.03023727
111,"Why if every time I've put something on the hob, but if I have to leave the kitchen, and the chance of that cliff, would you not believe it? But like the open, it's perfect if you remember to do it. Oh, the grill, the oven to set because I know I have to because of the technology on that is absolutely out of control",0.0004585841,0.9995172,7.1688717e-09,5.329737e-14,2.34791e-06,2.1859616e-05
112,Each hob I could turned off in time.,0.6674288,0.12793007,0.097966984,0.0050740982,0.07123206,0.030367978
113,"It's it's it's getting it's getting worse as hard as times going on the stopping you just using the phone and you're being forced into it, which I think is wrong. But to do this, it's not to be human. Yes, and that's where I live there. But there are a lot of people who say I called that one particular service pool and said, we call this all medication, and they said, Well, we're not going to do this anymore. And that is wrong. Go online doing an e-consult. I am speaking to the doctor. I have to do. So want to hear how many people are falling sick because of it? And I think that is a huge barrier and it is causing people to go to the special care, because they're not being as that. What we don't mind coming up to date a doctor place isn't great. But outside agencies have also got to realise they've got to. We're not all. On the same page is that we're not using the technology.",0.15594304,0.575956,0.008330977,3.5471065e-05,0.030692073,0.22904246
114,"OK. I know. Yeah, but you were able to ring them up. That's right. Yeah. You think if they had?",0.5718014,0.19505167,0.012853488,0.00037863877,0.02850763,0.19140714
115,"Yeah, yeah, you hadn't realised that the word risk was.",0.44605395,0.27544475,0.041813333,0.004141281,0.027926883,0.20461978
116,"There's going to be a follow up session, I guess.",0.16592652,0.5735238,0.01340181,0.014290908,0.13244292,0.10041404
