,Tweet,Anger,Disgust,Fear,Joy,Sadness,Surprise,Trust,Anticipation
87,"I use it for groups of which I am myself a member and the worldwide groups, and I use it for church activities, which I am a member. And I also use it digitally for communicating with my children with a portal, which is a magic machine. I just make telephone calls by saying to the television, Please ring Harry and Harry's on the television.",0.058855776,0.17576993,0.28749338,0.21524489,0.037034955,0.034701124,0.16558175,0.02531819
88,"I also wondered about that one. Well, I'd probably get it for my family. Well.",0.007392422,0.0018595945,0.0499221,0.10709314,0.037221752,0.4883882,0.21367887,0.09444391
89,"So having said that, I'm not keen on it if I think about it deeply because it really does eliminate social interaction. Person to person, yes. So although I'm spot on a bit of a coward in a way, I use it. But. The back of my head says I don't really agree with this.",0.08782904,0.0071564396,0.19882125,0.21204129,0.14652422,0.021815911,0.3222462,0.0035656746
90,So it is both,0.016753834,0.0049357563,0.047731534,0.18714869,0.036755502,0.19804476,0.4955077,0.013122235
91,I would say the pope was there on a big TV screen. You can see the state that was behind the screen and completely look like you got real bad luck.,0.0063882363,0.0034507897,0.019263702,0.075793654,0.0037558372,0.025157593,0.86385953,0.0023306762
92,I only got this because one of my kids bought it for Christmas.,0.00090174435,0.00047324077,0.00094344595,0.5919159,0.19006024,0.18357697,0.02603794,0.006090517
93,Yeah.,0.0049883868,0.0050767465,0.009239294,0.4443047,0.032086007,0.32340598,0.17296685,0.007932046
94,"No, I think I said digital interaction. Um, communication is important, but there are still a lot of people that don't have that. They don't want to. You know, I'm. I got it for just over two years, and I'm still scratching the surface with it, um. People come to me and ask me. Because so wrong when we computed hello. No, but your son can work for the education services on I.T., you know? So, um, I'm more a practical person.",0.04080432,0.049519904,0.06085066,0.024425022,0.028816057,0.6400214,0.1339175,0.02164518
95,"Well, the way I've been thinking. I'm sorry and everything things down because I'm so used to doing it. It seems to be self-care, social interaction, and I guess it's not so magical. So it's self-care. And that breaks up into all sorts of activities, social interaction and medical and financial. Accessing those.",0.02189522,0.006842428,0.162562,0.7191191,0.005562149,0.0021506562,0.062144343,0.019724134
96,You're good.,0.0018533082,0.0021982295,0.021725567,0.033428393,0.0037537275,0.12363901,0.8109599,0.0024418635
97,"Do you think that a lot of people think a realise that you know about self-care, that is important",0.036516186,0.020746203,0.045261826,0.034700684,0.018121772,0.016986115,0.822228,0.005439179
98,"exactly what is it? See, I use 40 words but two would do. Yeah, yeah.",0.057543654,0.017544376,0.09379814,0.05981131,0.06750555,0.14906335,0.5411744,0.013559195
99,All the different activities tells us that it's totally those,0.17237413,0.009310233,0.13844047,0.14818335,0.052450504,0.16593619,0.285352,0.027953126
100,"same as activities, you know, even though it's essential to you. You know, I've got to have a bath. It's an activity or a shower. You know, it's an activity.",0.05312327,0.001677541,0.35356423,0.29539013,0.00029870015,0.00015899118,0.2950341,0.00075304013
101,"But this session don't, isn't it?",0.0044861403,0.0003234614,0.05944032,0.1682116,0.028123392,0.099140726,0.60783094,0.03244344
102,"People say to me, Always enjoy what you do or enjoy doing what you do. I have got saving for life, and I'm fortunate to have that. Um? Well, so, I've seen people that hasn't, you know, people",0.04765347,0.019047558,0.00653654,0.5612997,0.025361335,0.15026501,0.18918146,0.00065494626
103,"with it, isn't it? Two things of the three important things is some of the things you want to do, but there's some things you have to do of those, those three, all the activities you have to do. You have to look after yourself. What was the middle name again?",0.19803238,0.008030495,0.08780331,0.2878009,0.0005343398,0.00042291894,0.41734913,2.6516156e-05
104,"So social, interactive. Yeah, your health and well-being is included in your social and stuff.",0.0023947598,0.000906782,0.0059599513,0.73138756,0.01892591,0.09998615,0.13704722,0.0033916703
105,"Because there was no idea. OK. She's not confused. I'm lucky because all I do is to jump on the bus and go into town do some shopping there is this. I was used to thinking of reserves with that stuff. Yeah, yeah. Tuesdays I used to go for lunch at the church in Glenfield. That's yeah. Well, now I make myself go into water for a walk on the road or catch the bus in the town.",0.027618252,0.0029871543,0.16948356,0.6300876,0.0048281476,0.014209141,0.14045696,0.010329154
106,"and it's important. Yeah, if you talk about what's in the three top important things it's important to and yeah, I think I just think you're good.",0.008600896,0.0015824017,0.012115848,0.011767601,0.0027183138,0.00555895,0.9533571,0.0042988975
107,"But I think the transport as a part of social interaction is vital. I mean, for example, I've got a son who's a copper in Launceston. Yeah. Now I'm going to hop on the bus right outside my door. No one from here to those tables that hop on the bus and I get off at Tesco's in Launceston, which is eight minutes for my son, he collects me in the car. Yeah, I'm just starting to get some of the best of Tesco's naturally, but",0.06975904,0.013051872,0.32725173,0.3318208,0.007769559,0.022681944,0.16989645,0.05776861
108,"then I'm fortunate I've got a car hold beloved for. I don't know what I do generally road some of the residents around to the garden centres that help yourself, you know, so I've got no taxis but waste money on taxis, you know that. So I enjoy getting out excuse to get out. And so that is important to me.",0.25017852,0.00046764486,0.13233395,0.23312122,0.01365143,0.009717918,0.35808456,0.0024447707
109,"Um, with transport going on that, yeah, I'm limited.",0.005624146,0.003259397,0.010849344,0.09081331,0.040397637,0.6674634,0.15537907,0.026213694
110,"Yes, you are.",0.017639918,0.02147304,0.023667324,0.38511097,0.031433377,0.11804345,0.3993896,0.0032423309
111,"Yeah, yeah. But I mean, I'm pretty nifty getting on and off both the load, the ramp and stuff. Yeah, crashed of the south on the bus that we gloss over that. But it would be here if it's not on the bus route. There's only a certain type of taxi. I can have a map, but you probably yeah, it comes back to transport. It is huge.",0.010317027,0.0003103773,0.019183964,0.17242503,0.0026642827,0.009174465,0.78169733,0.0042274944
112,"Yeah, yeah. Is there any approximation when you crashed on the bus I worked with was comedy, a nightclub, three buses in the depot.",0.0903748,0.009823554,0.013259725,0.74007255,0.047006287,0.06166306,0.033611935,0.004188112
113,"So I burst in because the crowds in the way that I went because it felt I felt pressured to do that and put the post goes quiet because I do like to use to drive. I do reverse parking and they'll go, Oh, you know, the flashing to the side? Yeah, something out.",0.08446042,0.0017280469,0.045577016,0.05187709,0.002338026,0.069614924,0.74282694,0.0015775402
114,"I don't know his picture post. You can't, you",0.004427164,0.0023900713,0.017596863,0.009151321,0.0637164,0.083167695,0.8097885,0.009761954
115,"know, it's a self-drive 'cause people make up, they go off, right? And I had two arguments to have taxi drivers in Plymouth but I didn't hear. He started giving me a lot of, you know, doing that and I'll get off an engineering and technology made.You would think a lot about Typekit. I think more people are going to get hit by a car, but yeah,.",0.013919153,0.004708333,0.006761777,0.73954004,0.011478687,0.10140773,0.12163784,0.0005464546
116,"They are know what you're saying, but it's all about climate change and people have to suffer with climate change and not just because of climate change. Electric cars, like you said, they're very quiet. I've never stepped out looking the wrong way, but you know, you don't ever call me, you know, so there's no",0.02050975,0.0019644909,0.028227735,0.0512602,0.063199215,0.061791074,0.7724489,0.0005986623
117,"way they can let you know I'll meet someone who's I've been down to the Did you come from home? Yeah, I'm going",0.0002076051,0.00019572885,0.001207344,0.0015879368,0.0017863846,0.96528965,0.02672769,0.0029976587
118,"to say this about the guide dogs. All that because the guide dogs go by what they can hear. Yeah, yeah. So it's really massive. Yeah, yeah, yeah.",0.04124749,0.0067307777,0.18364406,0.36005956,0.0040279124,0.0023320285,0.39990357,0.0020545977
119,It's not been introduced.,0.02618577,0.005043837,0.05402366,0.05245439,0.19005777,0.21321538,0.41641688,0.042602316
120,"No, I know",0.0037500577,0.011923723,0.016352475,0.016367102,0.08148087,0.28582725,0.5729586,0.011339939
121,what it's,0.016696922,0.010542053,0.13453136,0.0881158,0.033427637,0.25180304,0.44612783,0.018755328
122,"like coming otherwise three three years in this place. But in the Pines University here, 50 years ago, it's never, never",0.023117568,0.005965147,0.018925894,0.029585166,0.16870086,0.15491644,0.4483796,0.15040934
123,"been a polytechnic. Yes. Yeah, I think so. She's very down. That's all you need to know. Oh, yeah, yeah.",0.017615316,0.0048446856,0.040798932,0.102330305,0.048033666,0.28436068,0.47391748,0.028098933
124,"But it was a complete idiot or not. One thing I miss is my driving licence and I can't drive. And I just let it lapse, like living in France and Belgium, and I didn't need one because this is I just never one of  ...",0.061870843,0.0008359472,0.14905243,0.5372741,0.02571273,0.010713092,0.212352,0.0021888402
125,"Yeah, we're getting my driving licence back. It is not impossible that they have a point because I'm insulin dependent diabetic and had four heart bypass. I have cancer twice. They take all these medical things into account. And because you're over 80 years , You wait for years to get your driving licence, which is really going to make it hard to just renewed your degree and wouldn't have any problems in this country.",0.122947104,0.001772349,0.23852456,0.06358197,0.00585083,0.0006636963,0.5582766,0.008382914
126,"When you think of how the world's changed in the past 80 years, it's just a man. Yeah, and frightening.",0.017822526,0.006238252,0.7003646,0.091686666,0.049147412,0.012300921,0.11353997,0.008899671
127,"Oh yes, totally.",0.0090500545,0.0032244413,0.009338251,0.59168655,0.016874999,0.3083418,0.05538764,0.006096251
128,"see these films that come out, you know, robots.",0.006285003,0.0039527696,0.09821147,0.19032209,0.10221497,0.24154294,0.13094087,0.2265299
129,"But a very Victorian upbringing wouldn't even have electric vehicle guests if that oil lamps, no wireless or anything like that.",0.008996492,0.010225227,0.05291525,0.07366729,0.12734552,0.32025638,0.3944954,0.012098441
130,"it's kind of my generation now. You know, I mean, I can't imagine having a television since I was a toddler. But when microwave was coming you give me pause and think that now you feel like I can't give me that one?",0.018046856,0.0013800446,0.03404049,0.6269683,0.20405723,0.007953626,0.10629673,0.0012567241
131,"Well, my wife wouldn't have one she wouldn't use it to get the room microwave oven.",0.002236753,0.0074523455,0.0041727754,0.0068456973,0.05724477,0.72234815,0.1978347,0.0018647857
132,"Well, I think everyone was horrified.",0.008818536,0.03616304,0.29369047,0.007716578,0.013720779,0.5997459,0.03827476,0.0018698731
133,"Well, I think we read you talk about radiation and not what you think. You find that you know what's going to happen.",0.00827706,0.0032019832,0.03832814,0.03176454,0.031963687,0.5515026,0.2713855,0.063576505
134,We were worried about what's coming out of the Blue Submarine.,0.0024184713,0.0013645362,0.511101,0.009028053,0.0023580042,0.087226614,0.33753273,0.048970565
135,"So I went to my well, I spent most of her time in the spinning wheel to yeah, yeah, straight on the spinning room. And she was very well as well.",0.006725582,0.0019000865,0.0075368932,0.12853938,0.0395984,0.7961002,0.015153973,0.0044455035
136,"And frankly, that was",0.013671897,0.008415621,0.07374801,0.48830825,0.058285978,0.1485615,0.19496699,0.01404176
137,"in an antique shop in the day and the end of the old toys. You know, and it's just like this spring on it and this little bobbing on it, you know, it was kids entertainment. Then, you know, and then you try and get a kid now like you one of them night that five year old knows how to use a computer about the knowledge. And it's. Oh yes. So I do have dyslexia, you know, so I struggle with things and not very retellings have to be told this is what you've got to do. Something finished telling me I've forgotten the first part. You know, so I don't know what going to be like in seventy years. I've no idea.",0.0020156775,0.0006128407,0.051641736,0.04046026,0.018457312,0.6956317,0.1601439,0.031036606
138,That that scares me. I want to run a self-drive car sitting in a car andI can't control the steering wheel which is moving along the motorway that terrifies me. I like to be in control.,0.038557377,0.009194587,0.7877752,0.12096073,0.02688104,0.0037473475,0.0065042954,0.006379409
139,"Well, we are in a way because we, you know, somebody at the front and control. You know that because that is",0.09740851,0.025246803,0.19839655,0.025111146,0.06801945,0.07459308,0.505535,0.0056894356
140,You don't know that on the docklands light rail that drives itself.,0.033942718,0.0069715297,0.014149154,0.07726963,0.03842698,0.63358206,0.18032783,0.015330116
141,"Yeah. And when you talk about planes without pilots, I mean, I won't even go on a plane anyway, you know, with the pilot",0.0832638,0.027016263,0.2844594,0.04031161,0.018840967,0.044859324,0.49385208,0.007396557
142,"of these cars. Driverless cars? Yeah. But you know, there's not a lot goes wrong with the mechanics of the computer. Who do you blame in? And I think both someone killed recently.",0.08875836,0.008556623,0.109982446,0.058315195,0.32975513,0.007042179,0.3969824,0.0006076707
143,"Yeah, that was yes. Yeah, yeah. Oh yeah. Yeah, yeah. I wouldn't know. Did frighten me. Right? The Wi-Fi goes down. You go, Okay,.",0.049929816,0.029236259,0.04586596,0.051776122,0.08134368,0.47893238,0.23813093,0.024784844
144,"If I get in the left hand drive car. Yeah. Even though I know so many drive, you know where I'll be banging my feet on the floor when you go to a break and you just instinctively think you've been driving for a long time. Yeah. And I mean, even get my car out of an adapted factory to be left for the accelerator and the brake, and for 40 years I've been driving.",0.094359875,0.0039592925,0.053224508,0.8177888,0.010261243,0.00812837,0.011003475,0.0012744312
145,How did you get on doing that? Because they tried me with it?,0.17398219,0.020294936,0.17938057,0.050490785,0.09021056,0.046165653,0.43291384,0.0065614646
146,It was easier than I thought.,0.0035383038,0.001934995,0.045927275,0.007848843,0.016365454,0.34527192,0.5758053,0.0033079416
147,I wrote off the gearbox.,0.012688552,0.006945213,0.16099103,0.07476261,0.032344498,0.41878426,0.26932746,0.024156405
148,"What I did before I got the car, I got in touch with a driving school that caters for disabled people. And when I got in the car and I said, Look, I'll be driving this in seventy nine, I said. Now the problem, do not say anything about my driving this bad. Tell me, but I don't want to be criticised, you know, because you have old habits and drive you driving your own way. And I was a bit edgy, $40 a throw, and it was only a tiny little car, you know, and I thought, I'm going to do wheelies and I brake I brake too sharp, so I have to concentrate on that. Then the car got the Nissan Qashqai sitting in there. It looks massive extra to get it. OK, now driving that for a couple of weeks, I was nervous. Is that on the road? Because trying to get out of style where I live onto the main road and I'm waiting for traffic to grow. I've got a gap and I just hit it slightly too hard. We're spending trying to get out, but now no problem.",0.0075069005,0.00051848666,0.14598556,0.6989418,0.025725808,0.0023079426,0.10561018,0.013403308
149,"Well, what they did with me because I can drive by right next. I can swap to. So the process was 19. Yeah. And occasionally the automatic. What do you do? I panicked because it took me straight out into the main road which I did think it was stupid. Yeah. And so I was I was I was nervous, so it didn't make any sense. What don't you do with an automatic car?",0.28651252,0.0038015929,0.18566698,0.014342682,0.036919147,0.3786734,0.07714516,0.016938502
150,"Yeah, I've done my right leg suddenly burst into life, I suppose.",0.022366269,0.01286718,0.032708596,0.21311788,0.15360755,0.24299689,0.31066123,0.011674427
151,"Yeah, I've done that. Come up, take Pulling away the automatic changed gear.",0.09284768,0.012550047,0.33431813,0.013986883,0.20659775,0.16129102,0.16492157,0.013486918
152,"Into face to face, so to drive. But yeah,",0.062857546,0.017391205,0.20835404,0.3742907,0.13371101,0.0784304,0.09853662,0.026428489
153,"it was the first time I drove an automatic car. Not adapted. Yeah, not a standard automatic car wasn't concentrated as it pulled away before it went to the clutch. I hit the foot brake. Yeah, I mean, by the way, through the windscreen fortunate to the seatbelt umm",0.075581856,0.0025909329,0.24504858,0.14646533,0.10729146,0.0062120124,0.41492918,0.0018806434
154,"Oh, well, then you go on that. Yeah, it was just  you're naturally link stink when you're driving. In some betting. You can just get in the car. You don't think about anything. You can get and off you go, All right. And again, with all that I'm going off to Manchester in a couple of weeks. Yeah, I've never been further than IKEA Exeter and looked a bit nervous on the A38 driving fast I don't know why. I mean, there's going to be in Manchester I don't know how how many times it's just one go basically.",0.007856087,0.00010424789,0.09497583,0.23231941,0.0063671363,0.03005684,0.6236918,0.004628671
155,"I can't drive now, it's one of the drive and you just really. Quite dangerous. Yeah, yeah, yeah. I am not supposed to drive anyway.",0.074148804,0.01945002,0.22037092,0.033281505,0.14498469,0.12240004,0.37762895,0.007735075
156,"Yeah, well, I've got mobility scooter that I use in town quite a lot you know, but I'll throw in the big free cash flow and.",0.01474474,0.003547768,0.09418306,0.06638735,0.02532013,0.21868207,0.53771293,0.03942198
157,I've got an ability scooter as well. Things I don't know. I would have come on that today ...,0.031841077,0.002735764,0.12287263,0.07461799,0.27615684,0.24826683,0.072168075,0.1713408
158,"Well, that's it. I've got daily fit to motorbike change. So when I finally managed to keep my scooter outside anyway, I'll change it off. yeah. even if it just showed a sign outside the shop that changed to that, you know? Yes, I've been very fortunate to have the ...",0.013720934,0.009403861,0.17040932,0.70974797,0.014925001,0.0076726456,0.07375655,0.00036372166
159,"The other robot brought was a cat. It was a cat seating on your lap. We have to right be outside TG. This is nine to nine this is not what the carer describes it's coming back...She wanted to buy it. So she wanted to buy it. That was a hundred sixty pounds. Other robot like this you did with Astro came in and said...Well, she locked the cap and she wanted it to buy it. And she says to Hazel I've got the money here and I'll give you the money  laughs it's safe to. They give it to Eric. He can sort it...laughs",0.007433341,0.0005151002,0.04657741,0.16743769,0.0046026246,0.0010584088,0.7722986,7.6835495e-05
160,"I know, a bit of a dinosaur. I'm quite frightened for the future over there. Well, I think technology has advanced far too rapidly.",0.0036147928,0.0028059243,0.75501853,0.03191448,0.034098987,0.0417766,0.12852058,0.0022501126
161,"Well, I think that's probably where a lot of people struggle with it. Either don't do that and I don't put PCH a big grade with doing the computer courses where they but there's a lot of places on the dome, but you got to pay to go and it can be very expensive. So,.",0.19806536,0.19318609,0.030494474,0.13360043,0.03619479,0.029450675,0.37533435,0.0036738089
162,People are supposed to deliver houses and so they don't do well.,0.14675635,0.020821959,0.027038096,0.07737857,0.13999069,0.41432858,0.14948824,0.024197519
163,"No, no. I mean, I always felt well, not always but recently the PCH felt a bit get a bit too controlling over us now. Yeah. When the rules change because of covid, we don't get told until a month after and we have a lot of us are desperate to get back to the coffee mornings and the bingo afternoon we can use the community room. We can't just use the kitchen. And I said, Well, Bring your coach down for tea and coffee, you know? And I'm borrowing a cow out in the courtyard. Oh, OK. A lot more can carry hot drinks on their own, you know, so they I got so oh, you can't do that.",0.10324092,0.016089818,0.035718,0.3919768,0.0863336,0.064900436,0.30063996,0.0011004396
164,"Well, what about this is the percentage of buildings with these thermal cups? Yeah, you can get some of them is what we're trying to do is say thank you can how even though the sort of thing and bring your own drink, you know how it's going to work because honestly, I'm just like, I just manage, yeah. And if I go to shows and stuff, oh, well, we're going to try and find to have those cardboard trays thinking about it so we can help people.",0.0014183704,0.0001613721,0.016870558,0.087921396,0.0004805074,0.512941,0.37691838,0.00328842
165,"Yeah, right. I've got a cup holder which clips up the week and the wheelchair.",0.009430961,0.0006387633,0.00329363,0.30986738,0.020724008,0.63907963,0.009691283,0.00727435
166,"Oh, have you?",0.0072531328,0.0034944483,0.031371895,0.11259314,0.022165185,0.60577786,0.19623205,0.021112312
167,"And I got it with a thermal cup. So the thermal cup  will fit in there. You can buy them. Usually Because you can adjust, you can adjust the the whole, you know, the the clip on it. Um, whether they want that, I don't know. I mean, if you was a guy, I've got thermal cups mine are that old now. No, they don't overheat that much. Um, but like you said, talking to my sister last night, she said, Well, you know, I thought if we got thermal cups then you can bring it down, a lot of them got what they call them...",0.014514138,0.00058902346,0.39429224,0.055797257,0.0048146066,0.02128713,0.5020501,0.0066554956
168,"What we're saying is, you know, like, maybe this was a sale in the courtyard. A lot of them can't bring hot drinks down. I've suggested they put the the tea and the coffee in their own cups bring it down now, Boiler Co in the courtyard. But Debbie said, No, you can't do that. Do that. I don't understand why. Well, yeah.",0.038853865,0.0008739892,0.09204404,0.6680762,0.05211384,0.010068062,0.13329804,0.0046719587
169,I've got about anybody else.,0.00066094985,6.308752e-05,0.0579575,0.08600252,0.03455715,0.029769761,0.786786,0.0042030183
170,"I think I have made my kitchen was not there. So I think that the wheelchair in the house is one thing. But if you will, in the future, going to have to have mobility equipment like I have a walker as well a space around and that you the units and of that can be dropped if you like can be lowered and which might have been so I can sit in the wheelchair does under certain types of kitchen things that my oven I can't have one with the dropped down door , it's not safe for me, but I have one of those those sliding they are brilliant. So that's socially but not so you can just explain it is cheap, and.",0.03596683,0.002934585,0.25050572,0.122380905,0.0042736684,0.008164716,0.5721408,0.003632779
171,I didn't quite understand what this door is.,0.047872897,0.030919854,0.16774681,0.008841065,0.057442706,0.40349254,0.2709086,0.012775532
172,"Have you ever seen bake off the bake off it, right? What they do, but be put an oven door down what it does disappears underneath it slides underneath.Yeah, because I can't have anything in front of me. I've got to be able to be right in front of the oven book because it slides on. I think it's called Hide and Slide or something like that.",0.0051305383,0.001195573,0.06455358,0.91374207,0.002188852,0.0011603396,0.0104534095,0.0015756316
173,"Yeah, I understand.",0.026521413,0.011525409,0.036966067,0.2711634,0.04780595,0.03981645,0.56085306,0.005348245
174,"And it's it's excellent for that unless you hang on to it. If you try to move on, it goes and slides and, you know, expect it will go on the issue. But the other thing is, what about that? But it's it's brilliant for that because I can go in front and in the wheelchair, sometimes not too heavy. I go to the side. So the kitchen equipment, I think, and otherwise I wouldn't use the oven. It's as simple as that and it's got to be easily accessible.",0.003454534,0.0027792421,0.039837565,0.4668572,0.007476927,0.01468768,0.4645672,0.0003396675
