,Tweet,Anger,Disgust,Fear,Joy,Sadness,Surprise,Trust,Anticipation
175,"If you look in technology and internet stuff it's kind of sounds awful generations come and go as they age, they will be brought up with this man. It's the wall of the rest of us. So the older ones now generation today, the generation that the older generation that I'm no longer the older again generation, maybe that has never used the internet and are still frightened of it, but that will adapto us, yeah, but as the years go on. Sounds awful. As the new generations come up they will, they will embrace all of this. And which we maybe not",0.020254707,0.0028304104,0.22301108,0.10376389,0.003272174,0.040157504,0.5870939,0.019616349
176,"answerable now like the zoom. I mean, it might be simpler than the same I've never used zoom We've used a different type of media thing to use, but weren't operating now the guy who runs our mention he was operating it sometimes successfully, sometimes not. It is technical technology challenge if you like, love it laughs. The colleague I'm talking about. Well, it's. That sort of thing, if somebody said to me, Oh, you need to get on to this, you need to get on to that. That scares me. Like you say, it does scare you technology, am I going to be using computers for about 22 years and I'm still just scratching the surface. I can do e-mails.",0.013211972,0.0072543942,0.7278004,0.064136334,0.009507536,0.034882125,0.13496947,0.008237729
177,"I don't know what it is. I think it's a fear of the unknown. And you read about all the scams. But I mean, I can do the basics. I can send the emails attachments, I can open the emails. So to me, I can do what's important to me. Um.",0.0013244007,1.6109124e-06,0.01790561,0.091947325,0.00074346364,0.00060557236,0.8874155,5.6494875e-05
178,But it's not what it's about. Why would you have to if you're doing enough to meet your needs? That's what it's about.,0.018746346,0.00248901,0.029306324,0.016322836,0.007398553,0.0049287854,0.9180038,0.0028043254
179,"It does for me. You know, like I say, I use my phone to do it. I've got a laptop not used for about three years. I've got a tablet. I get a struggle on that when trying to get onto the home page I need. I used to ask a friend to bring them up, saying I'm struggling come around, he sort everything out for me. I don't see him now. and the other friend that did it. And unfortunately, she passed away. So I feel like I'm on my own now and I feel really at a loss because where I live, I'm probably one of the youngest. You know, so there are some who use the internet, but mainly for shopping or ordering food online. And that's it. No, I don't do that. You know, I'm old fashioned, so I just like to, uh. I'm happy with what I can do But there were a couple of time later on when I make stuck in the house and I need to do more on the computers and things like that, and I just don't absorb it there. I do have a problem with dyslexia, but I know what the government member is.",0.09121798,0.009629977,0.021059968,0.27459478,0.06293987,0.090668716,0.44309366,0.006795032
180,"To me at the moment is helpful, but there are people that have made that go insane. It's all. And I think people do struggle with it.",0.0036355003,3.450691e-05,0.009036872,0.014119439,0.0012490979,7.698478e-05,0.9718305,1.7109027e-05
181,I struggle with that. Yeah.,0.03878731,0.009577599,0.03849743,0.10162745,0.1392982,0.07662077,0.58103436,0.014556884
182,"You know, so if it's like you say, it's what you said, so you need to give it. You want older people to embrace it as because they don't need it, make it easier. Make it less scary. Yeah, they get that. Sometimes these iPhones. I mean, I love it. I'm a geek. Yeah. As soon as therie is a new technology I want it! But I'm lucky enough to become A.. I've got friends that was so, you know, can't understand it. The technical wording is too difficult if you make it simple wording. Yet I just say press number one press number two fine. Why would you just interface? You know this? I love it, but I don't understand a lot of it. Make it easy. We want older people or people who are scared of it to to embrace the technology. Make it every dayable. Yeah, if that makes sense. Right?",0.10892422,0.000517608,0.05379664,0.15676019,0.0022251431,0.009697833,0.66729987,0.00077849923
183,"Maybe some people are scared by technology, including me. Some people are not like Hazel or she doesn't know about technology.",0.01924275,0.06993778,0.26021963,0.0003144602,0.006240868,0.5284344,0.11220008,0.0034100248
184,Not as good as critics.,0.0038516687,0.0005951123,0.015158114,0.11622224,0.060308874,0.049466338,0.7508983,0.0034993405
185,"For example, I think it will become to some extent now. We don't see on the news all the hundreds and hundreds of people who are losing their life savings through internet banking. And they are.",0.06240353,0.037775226,0.14554441,0.15685208,0.05238247,0.032115553,0.5120079,0.0009188365
186,"Yes, I saw on the news with the eBay alone in the southwest, 25million stolen through scammers that we see in the southwest. You know, I've been ripped off. Nothing massive. The first one was about twenty five pound instead of six ninety nine. So I'm very dubious of what I go on to buy anything. And so it's very rare buying if you online, I go radiates cover for one of the residents. I'm supposed to be near to the. He didn't want to do it. He wanted me to do it. Yes, it looked the same. I was getting to the point where I was looking at the scene and I thought, I don't recognise that company name and don't recognise that company name. So I rang up my sister she said tribe from world. Don't do radiates covers, what they do, and you get special offers, so I ordered in that we've got it. So the next one he wants we'll order through the same company because we know it's genuine. Yeah.",0.003204848,0.0032844802,0.06592391,0.60580313,0.005469977,0.118789114,0.19108017,0.0064443815
187,"Don't you find it like your eyes on ebay, as you said, Oh, there's marvellous tablet! It should be 700 for 200 if you think you're going to get the genuine thing 200...",0.06360751,0.018858189,0.031492062,0.013804671,0.016824357,0.34810507,0.49462426,0.012683884
188,"No. You know, if it sounds too good to be true, then it is.",0.0108929435,0.0011071882,0.050819885,0.026793586,0.014620036,0.010654866,0.87916607,0.0059454027
189,Stairs without banisters for me. So especially without was a bit of banisters to.,0.004734853,0.00060932565,0.0122632375,0.7313028,0.052802633,0.026255434,0.1674492,0.0045825248
190,"Well, I wouldn't be without my handrails up the stairs now, and I didn't ask for. Oh, I've no reason to rub it down, but about four bypasses I've lost all my energy to having had colon cancer twice an insulin dependent diabetic. All sorts of things. And when I was last in hospital, they certainly organised at all these rails and I couldn't do without them now. But you know, I manage if but they were then and.",0.15937783,0.022785751,0.098870575,0.22539864,0.31289893,0.095325045,0.07600707,0.009336163
191,"I couldn't even let me stay and I can't. I've got two options, you know,.",0.08696114,0.013267403,0.13892607,0.016400306,0.060542118,0.015764667,0.6626585,0.005479753
192,"So I've got bars all around my house, even if that's possible, because when I go home, I've tried to make myself show for like four stuff stuff. Yeah, I think wherever I put my hand and, well, I set up. That's why we need your help when you come in the hole every everywhere around the world. So do not think you should design. So let's make it open. Right. But I'm going to go around the outside world. Yeah, because everybody everywhere I put my hand, I need a handrail. Yeah, there's basic, that's not technology, that's just",0.047987748,0.0017108842,0.03243454,0.7509556,0.008100469,0.027515907,0.12642998,0.004864888
193,"and whatever people might say about PCH. I mean, saying this year, but I found the wonderful, Oh yeah, yeah, I'm the beast and I own the property. I don't own the sort of walls and things, but that where I had a problem, they've done marvellous. The job and charge me quarter is because they have taken the bathroom and it was coming from the maisonette above mine and they spent four days with plumbers and carpenters.",0.105752796,0.25026375,0.03455608,0.1640898,0.053601984,0.31753135,0.028244482,0.04595975
194,"You yeah, you don't got a landlord. I mean, it is it. I was in associations, you know, as great as I'm going to put it words, which is helpful if you like as PCH. Yeah. And I know what they like. I work for it and now give me landlords, you know, and go with being grateful to like Hazel. Yeah, organising quizzes and things like that. Our place. Um, I mean, I know that's not to do with a lot of this.",0.1777721,0.0062445872,0.12905964,0.45230144,0.007436037,0.016226096,0.18624893,0.02471118
195,"So you've got stairless, haven't you? It is not the one that goes up to the floor. And I think we have seen that. We've got that. Yeah. So it goes, that is lovely.",0.106141835,0.0064095645,0.05011364,0.1576513,0.015077569,0.07878879,0.5787956,0.007021668
196,"Yeah, I've seen that in a DIY. Big S.O.S. Big. Yes, I think we've got a lift right goes right through to where he needs it, you know? That's brilliant. So outside lifts, you've got stairs outside haven't you? and you.",0.020091843,0.0012533306,0.29467154,0.12901501,0.003484892,0.014463996,0.524753,0.0122664105
197,"Look by my own house, yeah, so.",0.0154094305,0.0043801973,0.02712202,0.5900592,0.056669883,0.18167321,0.11432854,0.010357516
198,"And you can get these external ones that take you off. It's like a stair's lift, but it's external",0.022050507,0.0032528578,0.015930753,0.2334301,0.029638816,0.14937086,0.50942934,0.036896754
199,The one I'm thinking about to move back to the stairs up on the outside is a public footpath. Uh-Huh. Yeah. So that's a different part.,0.0050394866,0.00013199808,0.44973397,0.37849373,0.0008101818,0.00047864043,0.16530499,7.01087e-06
200,"We couldn't adapt where I used to be. I have what I have now because some of those that go through the others say that the future builds. It's already in place and things, but it's not like they can't be adapted. So this oh we need it to be installed.",0.0023426083,7.1414484e-05,0.0091903405,0.02692332,0.0056524198,0.0010179762,0.9544966,0.00030530957
201,"I also think it's important to appreciate what we've got. Yeah, I mean, yesterday, for example, if the gardener all day doing the gardens in the patch where I live, which is a big area with the dust bins in the middle, in a cage, and if we go up to the garden to have a cup of tea or coffee, you can do no wrong, you know?",0.0057600657,0.009868879,0.2674529,0.25821522,0.019499118,0.17030263,0.25789097,0.011010239
202,"Yeah, they're not allowed to stop for tea breaks. Well, not on official tea breaks.",0.14571875,0.0107142,0.011391228,0.21286346,0.51834416,0.033543147,0.06579959,0.0016254729
203,Awesome. Really good.,0.0030290238,0.00086380617,0.0075926897,0.24351627,0.009438498,0.4095956,0.30287042,0.023093699
204,"Yeah. Very helpful. Even the ranges of caretakers. I know we can't I'm not allowed to come into your properties or if you need something, take it away, you can get outside your front door. The  communal , you know, and.",0.0022158942,0.00036620916,0.004236635,0.0011436825,0.0017298398,0.0032967627,0.98699653,1.4465748e-05
205,And if they were to pick up steak every morning picking up the litter at nine o'clock. Wow. Yeah. Emptied the bins every couple of days.,0.00012030241,1.2268463e-06,0.0002584546,0.9987241,9.636674e-05,3.5811398e-05,0.0007634157,3.1983387e-07
206,"Yeah, yeah. So you know, we got we do get a lot of help. It is really, you know. Well, I suppose there will come a time when I feel for it. Some people will need to move because of the environment that it may not be suitable for them now.",0.12747225,0.0026194886,0.106436945,0.19877937,0.03352795,0.030334454,0.49750113,0.0033283774
207,"It's hard to say because we all we all have different disabilities or health. I mean, we had a lady in our class. She was totally blind. And if you're having a coffee morning or bingo after you come down, play bingo. Somebody go for one of the residents of Walton, go and bring it down and take it back up again and ...",0.01740257,0.0027514836,0.057572104,0.78626883,0.004410844,0.00538627,0.12539694,0.0008109515
208,"I am about to have the bathroom changed because it's something I physically need. Yeah, and you said about being able to stay where I am. Yes, if I get worse, then the equipment that's being fitted, it can be again. I think this phrase know it's coming from a future group. They can adjust it so I can stay where I am, so I'm going to need. It's probably at some stage a way of showering and this new equipment can't be and have an add on so I can stay where I won't need help to be showered. So I'm keeping into handles. So that's important",0.35604814,0.03417406,0.07228713,0.17507294,0.032583285,0.051917452,0.26525295,0.012664028
209,"it will be based solely on this idea of being checked being built next week, and it's the hardest part of the electric service and Flamingo is once that's done and it looks perfectly normal. But if I get worse, they can adjust they can block put something onto that'll  help me, which again is thinking ahead.",0.029146906,0.0013703235,0.03471855,0.28072062,0.18369319,0.08379904,0.37292692,0.013624483
210,Improvements?,0.0077220583,0.0015920626,0.009973858,0.10783241,0.007236607,0.03735041,0.82267547,0.0056171133
211,"Yeah, thinking ahead. Yes, these things are built and put in it's thinkable ok. What like Bath? Possibly what you're saying? What do we need to put in now just in case? Yeah, I don't know if you understand.",0.057671566,0.0024402065,0.09116338,0.07123698,0.04752698,0.027313748,0.67997795,0.022669194
212,Sorry.,0.031115625,0.015581972,0.04703957,0.11151247,0.18673417,0.14622636,0.4398224,0.021967437
213,"It's lucky that you live where you are, where I am. I'm coming down my bedroom world and I have for 12 months and I've been trying to get it. I have reported it and they keep saying Yes, yes, we'll do it. I've had scaffolding outside my flat for about 14 months. Nothing to do with me. It was a flat blow that took them a long time to cure their down. Yeah, when I said, Well, why can't you expand it because it sounds like no, why can't you expand it? Oh, no, all the scaffolding has got to come down and we'll just build a separate little one for you. Oh, how stupid! The scaffolding came down last week, but I don't know where I'm going to get mine. They are all removed.",0.11538144,0.011125683,0.345157,0.09173185,0.04540973,0.14182621,0.23651773,0.012850376
214,"It's not mould, it is just the black strips.",0.036719136,0.009589005,0.09031266,0.13131858,0.1585605,0.09215924,0.43489125,0.04644962
215,But it can turn to mould,0.003126862,0.00025670396,0.007922093,0.051566493,0.034348935,0.01117815,0.8877106,0.00389017
216,"Yeah, and I have this severe case where and oh yes, it is definitely damp. It needs to be done. It's coming through the outside cladding.",9.145604e-06,2.7111173e-07,0.00078061054,0.99876714,1.1993374e-05,1.9890747e-05,0.00041034434,5.914356e-07
217,"Yeah, but it could spot, I think, what you're saying. It could be that if you go too bad, they have to say yes, it's not suitable for it to stay. Yeah. So they need to put it right.",0.036714748,0.0041118017,0.078172855,0.15898108,0.010825037,0.00944534,0.6981925,0.0035566592
218,"That can affect your respiratory system, you know, breathe breathing and everything else you do.",0.0060410155,0.0008567231,0.03850741,0.31228483,0.008360296,0.015627965,0.5947444,0.023577368
219,Do you pay rent ?,0.11478878,0.004060127,0.016481122,0.28664264,0.040699195,0.14921233,0.33967528,0.048440546
220,"No, it's my own flat, but we're going to come on those factory housing.",0.001432273,0.00079025613,0.021999883,0.10282156,0.0067940694,0.5924232,0.22515078,0.048587993
221,"Oh, yeah, so you're at you're like leaseholder.",0.008479754,0.010019655,0.006337308,0.03550819,0.01943892,0.77903557,0.1369197,0.004260929
222,"Uh, yeah, yeah. Yeah, yeah, yeah.",0.0059365337,0.0042644693,0.00536905,0.100257166,0.016949028,0.77827394,0.08062559,0.008324238
223,"Yeah, I don't know whether that's how to get things done. Yeah, there's a rent payer. I don't know, you know, but you do find that it would be hard if you to get things done.",0.0027079398,0.000110349465,0.001564692,0.0014855681,0.00027056632,0.0043579116,0.98944753,5.54654e-05
224,I've never found it difficult to get things done. I tend to put it in writing. I write a fancy letter to the little department of PCH. And I think that's better than a telephone call.,0.0061367117,7.35835e-05,0.078253336,0.849191,0.0026884608,0.011896133,0.046968862,0.0047919294
225,"Oh, yes. Different landlords, again, the different levels of what they will do and what they want.",0.0032952323,0.00093516306,0.016157072,0.014736464,0.0048857564,0.5699024,0.34528497,0.044802945
226,And they've now just in the past week introduced a leasehold forum which is on Zoom. Yeah. And are you going to have a personal personal contact if you're a leaseholder to discuss any problems that might come up.,0.1005558,0.061760757,0.06741612,0.18643032,0.0043441565,0.07891637,0.49550307,0.0050734063
227,"Yeah, of course if it's more regular. laughs",0.061908472,0.011258115,0.015077657,0.63456273,0.118333474,0.07808561,0.0724512,0.008322727
228,"Yes, absolutely. I suppose we're looking at, we get a bus every half an hour.",0.034705218,0.0005805721,0.0065024686,0.8183379,0.016141534,0.022357263,0.08361525,0.017759752
229,"Yeah. The thing I I don't use buses now, but I've heard a lot of complaints from some of the residents. The post that goes from town to 25, I think, is a one to the Barbican and the Hoe.",0.025030453,0.02339129,0.17475347,0.22736378,0.115000606,0.10753608,0.26071736,0.06620694
230,You have to be fine.,0.0153289,0.0017589417,0.016677141,0.022632387,0.011293275,0.012071788,0.9192005,0.0010370811
231,"And they went to use the normal single decker bus. In the summer they're using in the tourist bus. And then when the tourist bus comes and it's full up. Yeah, the regular people who live around there want to get to the doctors at West Hoe, can't get on the bus. Mm-Hmm. Mm hmm. And because of that, you know, enough, I think, is stupid. You don't need that. You can have the tourist bus on, but keep the 25 the normal service going instead of swapping it. You know,",0.13210315,0.038023468,0.03924517,0.36087465,0.008037752,0.025643246,0.39437068,0.0017018804
232,there aren't the amount of seats on the blue buses downstairs.,0.2007503,0.16157438,0.16171019,0.023938952,0.039765436,0.18230294,0.22196826,0.007989539
233,"No, there isn't no there. So you get a lot less seats.",0.014287068,0.006546969,0.006000784,0.033641167,0.025310209,0.15556933,0.7535767,0.00506779
234,"I mean, you see people that are able to stand but they're still using seats. Yeah, yeah, that's interesting.",0.040940374,0.021105502,0.030108143,0.012399776,0.03135734,0.11794746,0.7390637,0.0070777303
235,"So that, you know, that's here. I mean, I don't know about the rest, about the town and other areas. You know, I know you get some areas where the bus is every half an hour, and it can be every hour",0.04847111,0.00048233752,0.011479788,0.16546652,0.0033248025,0.0045314743,0.76496863,0.0012753161
236,"You get unlucky, within five metres of my front door there's a bus every 10 minutes. The 51 or the 21.",0.3550468,0.014563923,0.043629523,0.20106122,0.026433347,0.10605635,0.22202682,0.031181995
237,"Yeah, I have to ask, what does Pepper think? Because his head is this is kind of, you know, he's looking down",0.013055024,0.0030500263,0.06972028,0.07230902,0.04806501,0.123534255,0.63743055,0.03283584
238,It  is just too many red? Yeah. laughs,0.03431946,0.0085117435,0.07302023,0.58473,0.15817197,0.012625791,0.10436931,0.024251448
239,"It just gives you a right look, and ..",0.008169944,0.00023984945,0.02036174,0.24511378,0.006215315,0.0029789913,0.71577734,0.0011430526
240,"Oh, I think the facilitators is accessibility and that covers what you were saying about accessibility, and that's allowing for people like Gaynor to stay where she is, and she has to be able to use and things like that. And it's making it technology accessible as well. Mm hmm. So it's fair to say the barriers is the inaccessibility to those things.",0.017678251,0.004613427,0.2217024,0.20187032,0.0085240835,0.04834081,0.49648708,0.0007836272
241,"I love what you say about the house. Is that the future proofed? Yes. Yeah. We want more of that because we are an ageing population. Yeah. Yeah, we.",0.08285644,0.001273766,0.0042645624,0.69813836,0.0036045783,0.021593872,0.18422334,0.0040450837
242,"It's already in place, we keep coming back to this thing, but it's you're off.",0.015460675,0.0006601156,0.022666372,0.073912084,0.04466388,0.07231548,0.75475013,0.015571239
243,"You might also make one comment about the accessibility and I mean, I know this room because the astronomical society used to meet in this room and I belong to that we had a long time, but it just doesn't seem to be a hearing in this room.",0.06676396,0.005846912,0.013556783,0.05732226,0.7596675,0.056437895,0.03371978,0.00668488
244,That's right.,0.013898399,0.008583887,0.05005645,0.07570526,0.04252758,0.09586077,0.70662445,0.0067431973
245,Absolutely right. I noticed that. Yeah.,0.0012354809,0.0019630338,0.015166181,0.076980054,0.017975846,0.8026248,0.07648876,0.0075658136
246,"But I mean, simple people in here were wearing hearing aids. But there isn't any hearing loop here.  A hearing loop is something that you  fix in the room, it's not difficult, you put wires all around the room. We have one in the church, and so people with wearing hearing aids, they can set their hearing aid to the new system and then they can hear it might be worth mentioning this to university.",0.051195476,0.74758613,0.0034678627,0.006544272,0.02347986,0.13244347,0.020266604,0.015016336
247,"we have that problem on our face. So when you get a group of people sat down just talking amongst themselves. And then somebody's phone rings. And she talked about the fact that I can't hear you, there is too much noise. People I feel like say, Well, don't stay here on your phone. Go somewhere where it's quiet. They don't. You know you're right about these hearing aids. I've heard about, you know what? I don't need them. I just don't listen",0.09205224,0.00021588478,0.1493623,0.038429108,0.0008781364,0.0025950137,0.71313703,0.0033302896
248,"to him just yet. Yes, you should be like in our church yet we're hearing aids. And she said it's the hidden disability, and she wear them for the service and as soon as the service was out, she's taken them off and goes,",0.028751474,0.0018300912,0.06138212,0.6048567,0.018580996,0.01686191,0.2674916,0.000245095
249,"Well, but is it an invisible disability? People don't notice.",0.0076954914,0.00441327,0.03052182,0.01242449,0.029197862,0.54332185,0.37072608,0.0016991417
250,"but they don't have a lot of patience with usual deaf. with blind people she can always... Yeah, yeah, yeah. Yeah, yeah, yeah.",0.030144539,0.0087847635,0.012167432,0.20943144,0.013445706,0.13389781,0.5856936,0.0064346963
251,"Something I suppose I've learnt living where I live with people. We've been hearing aids and someone say, Can you speak up or or can you seat on this side to make? Because that's be good. It has to be bad, you know,.",0.025487816,0.17702553,0.14454144,0.016010515,0.018387815,0.15902448,0.43265873,0.02686368
252,"or speak more slowly. Yeah, I mean, I'm finding that with the telephone. You know, these companies occasionaly rang, and I get blown and I say, please start again slowly.",0.13477862,0.019913381,0.10382875,0.3297082,0.016473567,0.26672587,0.07525129,0.053320304
253,"Yeah, yeah, I'm lucky with my phone, I press on something and then it comes out very loud,.",0.09260493,0.0059970315,0.008770501,0.25575086,0.017914964,0.23144035,0.33812797,0.04939339
254,"But OK, so OK, you have used technology to help you.",0.058958475,0.020210491,0.032430965,0.103494294,0.15552261,0.2538653,0.3715453,0.003972549
255,Some people think of ISO because  I've hearing loop in the communal room.,0.20613928,0.14965148,0.05537956,0.16832094,0.07944528,0.24065237,0.09103431,0.009376779
256,Yes. Yes.,0.001763105,0.00035824996,0.0030667593,0.77501166,0.0039697587,0.09519356,0.11433181,0.0063051125
257,"I just said about physical places. And I have to say it's a criticism of the university. Where I live my home, I can only live one door away because threshold strips. Mm. Yeah. And I'm talkative I couldn't get out of the kitchen,  because the designers need to think, of, this is my soapbox. There are too many able bodied designers designing for disabled people. Yeah, they need to sit in a wheelchair and go round themselves. So that's just my soapbox that it might be. What I have come today. I had a real struggle to find somewhere to get to get in and to come out of the and the Cafe out the cafe. Yeah. You get to live with that. Yeah, yeah.",0.035672065,0.0055451915,0.083494514,0.33640835,0.0055782036,0.02516853,0.48835257,0.01978058
258,"Yeah. I would worry about catching me. I've got new leg, which we only got yesterday. I worried about catching that on these walking behind me. Careful, careful. You know, like you say, if you're in a wheelchair...",0.027773444,0.00014422963,0.15326212,0.4475515,0.017413193,0.002471754,0.3480255,0.0033582945
