,Tweet,Anger,Disgust,Fear,Joy,Sadness,Surprise,Trust,Anticipation
0,But my thoughts were to learn about technology now learning more about technology.,0.09268677,0.0025736503,0.051613867,0.30187538,0.2902235,0.051035102,0.17933449,0.030657234
1,"Um,. I'm not crazy technology, computers, even phones. I use my phone as a computer. I've got a laptop and a tablet about the use of make things right. So, um, that was it, really. And then I thought, Well, we'll learn something today.",0.028196808,0.0052930084,0.019126946,0.020282311,0.004209369,0.37863418,0.4949041,0.049353275
2,Yeah.,0.0049883868,0.0050767465,0.009239294,0.4443047,0.032086007,0.32340598,0.17296685,0.007932046
3,"Very. And yeah, yeah.",0.023879992,0.007916094,0.04324931,0.39990833,0.041225176,0.24262358,0.21546346,0.025734054
4,"Would you want to go into the, you know, bottom line, you wanted that you want to live on your place and do things in your own time?",0.017906822,0.0045126583,0.018019957,0.010638013,0.015452001,0.0066096685,0.92609376,0.00076713756
5,"It's about different disabilities in one way or another. Looking at the less on the forms so that was 50 percent of where we live. People has got different disabilities. Some people we see struggle and when I became disabled I thought, well, I could get worse as I got older and yeah, I want to be able to stay at home. You know, I don't want to be living in fear of people who live after me, or not being able to do things for yourself. And I think we all feel like that, you know?",0.0008267982,9.670538e-06,0.94056064,0.0023497583,0.0001233337,1.3253615e-05,0.056110717,5.8486366e-06
6,"So that's the reason I came. I love my home. Yeah, I love where I live with my home is, and I came here in the hope that I can learn to stay there as long as I can. And I'd hate to be in a residential care home, for example. It just would not be my scene.",0.09949579,0.019921988,0.18819667,0.013148049,0.015128254,0.025708186,0.6265626,0.011838475
7,I managed to be.,0.033160742,0.0051705525,0.017709948,0.23135625,0.02478152,0.42244107,0.25539002,0.009989893
8,It drives them nuts within a week.,0.021165248,0.0022650457,0.0884885,0.32836753,0.028352203,0.10925366,0.2862241,0.13588372
9,Freedom.,0.019167744,0.0022810102,0.17105216,0.5174401,0.013908273,0.009559876,0.26466382,0.0019270101
10,"Yeah, freedom.",0.014077061,0.0026812553,0.05942273,0.7242988,0.01187215,0.03872717,0.14707884,0.0018420249
11,My memories of being one's own boss. Yeah.,0.0029281795,0.0005374066,0.051785238,0.7605267,0.107844874,0.01491227,0.05262628,0.008839056
12,"Yeah, yeah. You guys have got memories. I mean, looking at a piece of furniture remembering. As a partner, we used to sit in that chair for example. But when you go into these homes, I don't think you're able to take very much with you at all apart from your clothes. All right. That's my understanding. I think",0.20113254,0.0077723926,0.011953615,0.005366765,0.026744196,0.07097951,0.6718201,0.0042308797
13,"it's that you thought correctly correct? You remember, Bill? Yeah, he's in a care home and he is happy enough. But he's he doesn't see anybody. How come the people in and he was running a video of where we live? He was the light of everybody's life in the, you know, he knew everything about the Barbican and everything he could tell you. He's in his 90s. He could tell you everything. And he was always pleasant to listen to. Um, when you went to a care home, you didn't see a lot of people in the building. You got a coffee mornings when you got down, you know? And so he's got more commonly where he is for each of missiles. He misses his family because they all live north and. To me, I couldn't live like that. You know, so,",0.005311588,0.0038075792,0.041947942,0.011189476,0.22811553,0.03518291,0.66602993,0.008415048
14,"Well, this picture?",0.0029831997,0.0013345766,0.01474611,0.441409,0.017631304,0.4089626,0.07685727,0.03607593
15,"daily activities, yes, it is",0.011307578,0.0010090258,0.04449202,0.26346594,0.009672404,0.025852164,0.6399654,0.004235447
16,"Get in and out of bed. Well,  just living. It's not an activity, it's just existing. In fact, it's very sensitive to me at the moment because I'm fighting for some way of being able in and out of bed. And it's happening to have a sleep in the chair. And then because they can't find",0.007267178,0.0007005101,0.060581494,0.8794712,0.0063632717,0.0032875426,0.042068183,0.00026061918
17,It's not even mobility is just some sort of equipment and means that I don't have to have a carer coming to put me in and out of bed. so if we are getting emotional it's a bit too ...,0.090514116,0.036095083,0.23853953,0.4430185,0.13236855,0.013600522,0.030950924,0.014912791
18,"It's little things that concern me to some extent, I mean, for example, one thing that concerns me is actually having a show of. Now, at the moment, with great difficulty, I might add, I can actually stand up in my best, but it's not easy to actually cross your leg over wow and stand up, but the council have put handrails, so you know, OK, hang on to them and I really appreciate that because without them, there's no way I could get into the best and little things like that I really appreciate. And I just wouldn't like to smell too much.",0.15994026,0.0017943413,0.0650254,0.19585323,0.10653033,0.088780865,0.3568724,0.025203155
19,"Yeah, I have a wheelchair. Yeah, which looks like the standard of the big wheel. Yeah, I have that in my shower room, so I transfer from one wheelchair to another looking out in the shower. I don't like it I would prefer to stand up. I've got bad shoulders and from trying to get the showering 100, you know, and you don't feel like you clean yourself as a proper boy but it is better than a bath. When I lost my leg, I was given one of the chairs a rise and fall from Millbrook. And that was great because then I could just raise myself up turn around the chair and put my feet down. That was from the bath. So I don't know if you've got one of them.",0.010301416,0.0011426436,0.5399895,0.2761294,0.0069273757,0.024831941,0.1389373,0.0017404438
20,I've got an ordinary bath,0.003161513,0.0011253087,0.04037553,0.5097494,0.011753626,0.36771423,0.053404965,0.01271544
21,ride to call when you put it in your bath.,0.01735071,0.004549344,0.05331216,0.09842943,0.0070667006,0.5424023,0.24175382,0.03513554
22,"Oh no, I got nothing in the bath except the best mate drive",0.008871686,0.00258943,0.047223736,0.19990689,0.13409163,0.14730337,0.44174907,0.018264195
23,"Yeah, I didn't know they existed till I got one. Yeah. And I thought. And anybody struggling to get in and out of a bath of bullying about slipping falling in the bath. I mean, say we really, for me, a period in my confidence that started off with a bench going across the bath and I nearly went headfirst into the touch. And so I was at seven. Not we're not going to forget, you know,",0.015621206,0.0026805876,0.057777967,0.2295444,0.13650107,0.21746138,0.32309756,0.017315827
24,"that period of time where we moved when I moved to now. Most of us got wet rooms. I think there's only one fly out the 34. It's got a bath. And their ideal for us, even if you only want a walking yeah, like I say, I was given that wheel chair just sat on that and it is quite comfy cushions say, you know, it's great.",0.022676121,0.0004369524,0.02617747,0.14585924,0.0077753165,0.024112549,0.7722181,0.00074424
25,Not for me?,0.012080607,0.004776139,0.075851016,0.030295659,0.2072974,0.04391555,0.6134266,0.012357016
26,"Yeah, that that bothers me because I have neuropathy means so don't feel heat straight away. Um, when I moved back in, I'm now four years ago, I was in a wheelchair. I'm in my bedroom. Very rarely wore it. Don't do this impression, but the important hello worked for me. I didn't have open air fryer and a small hub that was great while I was in the chair that was worried about leaning forward, bending down to get to the Oven. And even now I can bend down. Sometimes I can lose me balance, so it didn't bother me. And I think as I got older, personally that does concern me. You know, I've I lost me there like that. Be it, then I wouldn't be cooking takeaways. Yeah.",0.12428178,0.012707496,0.08602879,0.09983707,0.038470067,0.15687707,0.47625527,0.005542473
27,I like talking!,0.031267278,0.005414403,0.024528794,0.09847472,0.0065283356,0.19357955,0.6308305,0.009376405
28,"Yeah, well, not at the moment, but stairs, perhaps at some point in the future.",0.014118247,0.001046507,0.026177596,0.32646948,0.0045880135,0.029209765,0.58327526,0.015115131
29,"Yes. Well, also outside the house is two dozen stairs up from the road to the house, so maybe I'll have to move at some point.",0.050294243,0.003925788,0.18131293,0.34271768,0.0609888,0.1111549,0.22443202,0.025173659
30,"Oh, there will be no look area,.",0.0027398318,0.0010332175,0.0058044684,0.12308738,0.29664356,0.2982683,0.18594246,0.0864808
31,"Transport is probably one chance for trying to get in and out because they can't use buses or taxis because I have difficulty trying to get into a door had trouble getting your car, you know? Yeah, and quite tall. Not quite as you bend, I've got back and hip problem. I can't kind of move properly. It's difficult with me. So is transport is a an issue.",0.006154339,1.7572738e-05,0.0017412631,0.05614625,0.0032832266,0.00027757057,0.93226844,0.00011135074
32,"I'm glad you mentioned that because transport will be the top of my list. And the reason being that as long as I can get on a bus and I can celebrate it in a bus stop, I can see my children and one lives in Launceston. One lives in Woodbridge and two and a half hours on the bus. But the only problem I've got with buses are and get on the bus at the moment and get off. But. I've got a hopefully I can manage without a wee until I get to Bodmin.",0.009456751,0.00050744275,0.06908618,0.538869,0.0050109695,0.010925185,0.35085174,0.015292687
33,pretty soon because it stops them enough above me for me to get out and have a pea that I've got to tell you this too.,0.004220706,0.00025118847,0.0058515156,0.16490531,0.0063376375,0.23430339,0.57633656,0.0077936915
34,"Yeah, yeah, no. I'm sure I could go all the way to Bodmin to do a wee, awfull.",0.037075147,0.0055487375,0.036672764,0.37059876,0.16614905,0.14319324,0.14602847,0.09473381
35,"Yeah, I've already mentioned we're right. Yeah. You know, I've been since, you know, legally here.",0.020875882,0.003969326,0.009851294,0.33896482,0.06756272,0.30161202,0.16172707,0.095436856
36,"It's no, definitely not. But um. I think it's a good way of being in contact with people in families. I know it's nice to be together, but with everything we've gone through, you know, on Zoom or other social media, you can be your messenger through Facebook and it is good you can see your family talking to, you know, um,",0.00276698,0.0003944434,0.044583287,0.12039393,0.0010215103,0.0012588324,0.82927203,0.00030899156
37,"without it through your lockdown, you wouldn't have seen anybody that didn't have no children with anybody who didn't have that. You're isolated you",0.017068693,0.007116732,0.01848875,0.053696353,0.011049058,0.06192194,0.8269726,0.0036858602
38,"thinking, Oh yeah.",0.021042138,0.0041685505,0.04858087,0.51270425,0.10053305,0.19807063,0.09558325,0.019317225
39,"I mean, I think the said, I know it's unusual that the pandemic will take the effect on mental health as being. Of jobs,",0.0030753633,0.00013844644,0.007111219,0.7369467,0.029364541,0.00806702,0.18664056,0.028656121
40,"I struggle with it when I thought I had to isolate, because that meant taking early last year was to say isolate for 14 days. I struggled to quell my scooter to try to avoid everybody. Well, no shops open in town show free travel around there, but it can get scary as well. And I think I'm more scared now than it was last year, and I think it's because of the understanding of it about both the Jabs obsessive test yourself twice a week. But we have a great community where we live. We're lucky, we're very lucky, and we all realise that, um, we had nobody had the infection or anything like that, you know, the virus. So and we do sit downstairs. I'm not in the community when we weren't allowed to use that, but it's still sitting in the main entrance. You know, I don't",0.11432122,0.015102524,0.103454426,0.05773823,0.05293998,0.37366456,0.24040917,0.042369913
41,"do or out in the courtyard, you know, so we had the communication wasn't too bad for us. But if you look what your own in your own house and I think you're more isolated than I think communication right through technology is in really, you know.",0.054118074,0.016928399,0.0682601,0.09404438,0.056767557,0.4056298,0.27216977,0.0320819
42,"When some people can't drive a car, that's how you do notoriety before then. Once you try to ?  During lockdown I was stuck for two years. Yes. We just live in a bedroom and that's it is a shared house for four people. And I wouldn't go see it.",0.033312123,0.00085255154,0.1484201,0.6096277,0.055069916,0.01798256,0.13388667,0.00084837375
43,"And I just don't think even though we've got a community, we do face to face just in our reality now. You know, while they are still things like, do they really, I don't know what we would have done 40 years ago. I really don't, you know, so",0.028062409,0.005088955,0.011227559,0.016346186,0.021428593,0.022043647,0.8916476,0.0041550486
44,"You know, I was very, very lucky at the very beginning. I had a heart bypass and my daughter took me up to Kent to stay with her. Unfortunately, not going to school. I was there, so she got stuck with me for three weeks, unfortunately. And you know, any excuse because they brought me back in time or had my first job in Kent and they brought me back to have a second one here. Uh huh.. I must be horrible. Well, it doesn't bother me. I mean, where I live, we don't have a community centre. We don't have anywhere we can go and talk. So I was in the courtroom every day, but I just didn't",0.13088652,0.040246557,0.42832384,0.052710965,0.14987786,0.0124114575,0.18286824,0.00267456
45,"day. Yeah. Well, I'm lucky I live on the Hoe. Oh, so I've only I've only got to walk five minutes. I'm actually on the Hoe a life long live every day for a little walk and talk again. I mean, I used to see some of the neighbours, but. You know, we didn't mix.",0.0056921714,0.0045738863,0.08014501,0.017533574,0.02375923,0.09673416,0.76481545,0.006746544
46,"is the ones that couldn't get out in the community. I mean, there's the bungalows and we could see if we couldn't meet up with them and it was fun to see people there was certain neighbours that we had couldn't leave home. I don't blame them. And it could be that. And I love the interaction of people. But without Zoom and teams and all that, I well, I would recommend. Definitely. I mean, I wouldn't have been able to see my family without the internet.",0.019517345,0.001108376,0.008462011,0.12996161,0.0067165107,0.26842955,0.55818766,0.0076169465
47,I haven't got the internet or and I don't use the computer now just it doesn't bother me from the get go and don't bother me when I have to contact firms and they,0.0439949,0.0041190316,0.06765061,0.37596998,0.06490022,0.3020906,0.08610186,0.055172812
48,"or doctors. Doctors, now that they are nightmares now because I'm trying to get hold on to an e-consult and if you're not on the internet now, for your prescriptions and contacting doctors. That is huge!",0.055879585,0.0073545272,0.061297666,0.8073922,0.0015685521,0.025483565,0.038721018,0.0023028776
49,"yeah. Well, there again, I'm very lucky because when I want my prescription, I'll just bring up a little chemist in West Hoe and they they just routinely get it and they deliver it to me.",0.6521036,0.0018729283,0.012063227,0.024312481,0.0009370136,0.011024868,0.29743353,0.00025235067
50,I hope they are not going to stopping that.,0.0192756,0.0041550617,0.34722394,0.006100746,0.024663614,0.07507619,0.50243753,0.021067308
51,"Yeah, I'm very lucky.",0.004400281,0.0054944684,0.007827049,0.049528793,0.022690784,0.756758,0.14282872,0.010471951
52,"They've been very good press so of. I mean, I'm not with them, but some the our residents are yeah. And you know, I mean, that struggle. I don't even have to pay for my prescriptions. I got a text message from Boots's chemist because of pain and your prescription is ready for collection and closes the book. The booth came back only 10 minutes, you know? Yeah. So our customer, so we've been lucky like that.",0.0013677485,0.00041716816,0.0064140586,5.315509e-05,0.00013977496,0.025260374,0.0009374333,0.9654103
53,How did you set that up?,0.035687942,0.015106159,0.13596584,0.01854798,0.038118828,0.31677666,0.41397777,0.025818788
54,"But I was with Lloyds in Devonport. Then when I moved, I told my doctor that my prescription is going to Boots. And at the start, I had to keep ringing up, ringing up, getting prescriptions that over now Boots supply for it, for me.",0.025319075,0.0027283267,0.018602176,0.18342042,0.044430006,0.015133799,0.7076917,0.0026744618
55,My surgery will let you know what.,0.0057179793,0.00017607409,0.06876611,0.14092536,0.016687632,0.055546053,0.09527088,0.6169099
56,"We won't now go back four years ago. You know, these are driving where we have all agreed for, you know what I need from when they need it. So, OK, OK.",0.059150442,0.009029288,0.4440926,0.08310748,0.0066227866,0.0072517386,0.3846396,0.0061060865
57,And also this kind of forgotten health care.,0.008483265,0.0003891086,0.012415009,0.367089,0.16061243,0.32285538,0.12114781,0.007007974
58,"I forgot how my Doctor looks like,.",0.004209053,0.0007262874,0.0017372671,0.7764107,0.05330793,0.14935394,0.0050173295,0.0092374915
59,"Well, how can they see what you look like? It's only telephone.",0.052199893,0.013130932,0.03295913,0.10931877,0.3614383,0.18406212,0.22559205,0.021298794
60,"Yeah, that's my issue.",0.018728413,0.00066043047,0.0036062356,0.009537288,0.0058337976,0.011441187,0.9497579,0.00043478786
61,"and you know, especially with the chest problem, and it's a bit of a telephone consultation. And when I say it's a consultation, a conversation because you will only be hearing huh huh down the phone ...",0.100803934,0.010977534,0.08687334,0.5951194,0.002637181,0.0025771903,0.19360991,0.007401487
62,from the phone down and you prevent even breathe.,0.023492105,0.004847898,0.029755162,0.51163715,0.18052642,0.09003839,0.1316786,0.02802427
63,"Well, I was just thinking of touch wood how fortunate I am at the moment. I did have a partner who has a lot of difficulties that you seem to have. Yeah, you make a good point. Most of your doctors, but all sort of organisations I wanted to get in touch about my television license. And there's no number to ring them. Very annoying. And yet I've done so well.",0.030610178,0.0031734626,0.058051873,0.61107826,0.1386572,0.11782094,0.033993725,0.006614395
64,"You know, I mean, I tried to ring with William, and I try to ring them the other day, and I didn't find a number, My grand daughter found it on the computer and I rang them. Oh, you've come to the wrong place, you should go for hero.",0.059985932,0.00053035456,0.0068547586,0.07620798,0.0077979937,0.31597736,0.5306404,0.0020051633
65,"Yeah, I do get annoyed, really, don't you all?",0.05600525,0.015436714,0.014723744,0.022132525,0.009200415,0.041346725,0.8403366,0.00081800524
66,"Yeah, yeah.",0.006225747,0.005138517,0.007582397,0.28394318,0.02861806,0.52833605,0.12984855,0.010307504
67,"Yeah, it is very hard for trying to communicate concretely for people. And I think that's where you get fed up. And I think some people just give up to try to communicate with them. The next thing to get electricity, to know why you're doing this, why are you doing that? And again, people get put under pressure. Well, you know, it's it's horrible. Yeah, it's I'm quite fortunate I do get your scam calls, you know, text messages from my provider BT. And if I'm not sure I ring BT up, you know, saggy pants and stuff like that, you know so well, a lot of people don't know how to do all lot, you know?",0.039382666,0.016947556,0.15143973,0.26529735,0.0066992505,0.035100084,0.48150754,0.0036258192
68,"I read about after quite a lot of our residents doing jobs for them and things like that. It's something in my nature. I would reward myself and I used to work for, Yeah, and I still do it now. You know, that's what keeps me going mentally. You know, without all that I don't know, I'll be there enough income of our party, you know?",0.0017004121,0.00094925525,0.026703792,0.0061122174,0.0004996879,0.005787767,0.95678115,0.0014656916
69,"unless there is a  danger now if you were not switched on to the scam, they'll go and say, Oh, something with your back press one. As soon as you press one.",0.022317031,0.0002847225,0.2841966,0.0038552561,0.00021302058,0.000864662,0.6866019,0.0016668116
70,"Yeah, that's it. Yeah.",0.0062117847,0.0029519498,0.007091111,0.19065462,0.021816632,0.36916357,0.3955374,0.0065729143
71,"And you do it automatically like the something with the police and comics, as you know in the show. Yeah. They will panic, you know, at the moment of screen time, and I don't think so. And. But I would think you'd be lucky, he said, just don't don't don't engage conversation with people. But people do! yeah, and they get caught and they lose an awful amount of money. There's people out there, though this is awful, awful evil creatures that know it. And again, just because everything is online or on the phone. That's how you get people's lives in danger for all this technology",0.04223423,0.0043625156,0.035609465,0.11833073,0.016920796,0.121177934,0.6561653,0.0051990272
72,"to do something very plausible, the people very and I sometimes tell our residents like I've had this scam call, if you get a scam call or they're asking you to BT again, we say my payment last month hasn't gone through and they take my details. Well, I've checked my bank statement. I know that it was paid, so I didn't have to do anything else. I just blocked the numbers. But they come back with different numbers",0.0052148798,0.0006048236,0.012711285,0.882878,0.0018358312,0.014952384,0.08040221,0.0014005888
73,oh they did,0.017093142,0.026017465,0.23038745,0.13720898,0.040766798,0.36985028,0.16194743,0.016728466
74,"So it's it's never ended, and I don't think it will stop the way we're going to stop it.",0.037604816,0.0036979604,0.024477178,0.116095185,0.11719759,0.37803805,0.3072664,0.015622792
75,There is a way for these big companies don't want to.,0.0046935147,0.0010954649,0.21189846,0.0012600214,0.0029664135,0.049115445,0.7259246,0.0030460563
76,"You can't keep. Yes. Yeah. We have agreed to our place doing Taichi every Monday afternoon. I start doing it with them well, so a lot of them, our regulars, that they drifted off along with what your you can't be with the big group and this group called the Barbican legends, which there were a lot around the Barbican. They were coming in, doing this Taichi. It is very good for you.",0.033471707,0.015106352,0.20548631,0.032972172,0.026458433,0.5200625,0.1448561,0.021586457
77,"And it's a great way of being able to meet up with people. But at the moment it is not right to do. Um, I think they started it again and",0.00021826502,6.584888e-06,0.0060353656,0.9829892,0.00010052622,7.271092e-05,0.010577031,2.9482584e-07
78,"Yeah, for now we can't.",0.011099306,0.0011410096,0.024906486,0.33711815,0.04667473,0.14681976,0.42181626,0.010424318
79,"That's right. Yeah, yeah, yeah. Yeah.",0.026702132,0.009267657,0.014935197,0.2566483,0.041219354,0.36906978,0.25783587,0.024321714
80,"So if I can just just go back three spaces. Somebody mentioned television licences. Now there's no getting away from the fact that television is very important to elderly people who are confined to their own home. Yeah, now I'm 82 soon be 83, and I've got a TV licence because they stop the free ones. And this week, for example, I got a message to renew my television licence, and I haven't done so because I got so annoyed that the millions and millions of people have not even done last year's licence. And yet, so I think because it's so important that elderly people have the facility legally to watch television, it ought to be sorted out.",0.03794595,0.0005218681,0.14745156,0.74876994,0.0010298037,0.00037102992,0.06298848,0.0009213668
81,"Yeah, I get mine to be renewed every year automatically, and I don't know why, because by the people I to.",0.092164844,0.009622683,0.09373576,0.2802131,0.028421601,0.04087371,0.44478047,0.010187845
82,"I don't mind paying, but I do expect other people to expect other people to pay.",0.10932224,0.013315635,0.005895721,0.05823673,0.037482776,0.14227618,0.63093776,0.0025329918
83,"A little bit of back, some decent television.",0.024455063,0.005916306,0.009446767,0.15465955,0.52424765,0.10406097,0.17041877,0.0067949262
84,"The repeat programmes, you could expect a double bill for your licence.",0.017765317,0.0016807099,0.0062067425,0.05833993,0.007234689,0.7607917,0.1290541,0.018926797
85,"Well, we'll just make one comment on digital communication. I didn't actually comment when it was discussed. I use a zoom, a great deal and sometimes that as many as 400 people can go on Zoom sessions from around the world little corners of the world had never heard of.",0.020733131,0.0025149952,0.3282232,0.40265125,0.011149248,0.007659792,0.21204236,0.015026013
86,How do I use it?,0.05072733,0.0108922,0.3537945,0.052543834,0.07214828,0.055199195,0.38731876,0.017375924
