,Tweet,Anger,Depression,Fatigue,Vigour,Tension,Confusion
352,"But we also we've got a social group with a group of dancers in Germany where they have the floods. Oh yeah, a couple of weeks ago in Koblenz. And so, you know, we were able to kind of check that those ladies were OK and give them a bit of support and encouraging them.",0.09341371,0.78671944,0.058025405,0.040457994,0.020587167,0.00079628336
353,"Yeah. But when you get when you get older as well, your eyesight is not so good you could have cataracts or whatever. This order is going to be not good. So we need to hear people. Don't you to talk?",0.25573736,9.743997e-05,0.0017107406,0.3111329,0.30868867,0.122632876
354,"But hopefully, medicine is advancing as much technologically wise as as everything else. Hopefully, by the time we have cataracts, it will be this afternoon having cataracts done and off you pop.",0.0046190955,0.911429,0.0001838912,2.5522754e-06,0.08353312,0.00023234454
355,Hopefully.,0.06552474,0.24217063,0.09809506,0.0029939893,0.5481895,0.04302606
356,I will ever hopefully.,0.072279096,0.609325,0.10338308,0.0019820237,0.19047001,0.02256078
357,"Well, I hope I won't get what my mum's got, macular degeneration. She'll never be able to see again. No, she can see. But she had a cataracts off. That was really the won't take them off until they're deep. Yeah.",0.24312603,0.7327592,0.00076649856,0.0022776562,0.0007670719,0.02030355
358,"So I'm hoping to be like Steve Austin, the six Million Dollar Man. I'll just have them replaced.",0.17515713,0.5413909,0.018538808,0.00021477007,0.19417067,0.07052773
359,"She had a cataract off, and she can see close. Everything was black before she got this cataract  gone, off a few weeks ago, and she can see colours now. So I think she's it's still like fuzzy.",0.042610675,0.39328408,0.08920272,0.00043878003,0.029485084,0.44497868
360,"That is a little bit of a worry. You know, will the National Health Service still be here? Yeah. Well, we're older, you know? You know, that's a that's a scary thing because I've I've only known the health service, you know, and I've, I've, you know, benefited.",2.1739647e-06,0.9999872,1.167668e-08,1.3042865e-11,6.905539e-06,3.7157142e-06
361,"My my sister's a carer, but she's up in Sunderland up in the Northeast. And obviously, I live here now, so I don't take her. But I speak to her most of the time and I speak to her every day. If I'm home but if I'm at my daughters, which is a lot. I spend half of my time at my daughter. But yeah, yeah, no, I'm not a carer. Yeah, it's like being a mother again.",0.34293014,0.5008001,0.13498905,0.0023922464,0.013494908,0.0053936127
362,"Yeah. You mentioned something earlier about dementia. Yeah. And saying that, you know, if you've got dementia again, all of this is going to go is going to go is going to go, you've lost. Yeah. That's what all of your social connections, because unfortunately, you know, mentally, you're not able to ...",0.0071457787,0.9494729,0.009395027,0.0027120144,0.002497167,0.028777117
363,"your memory is not that good either. So you could have to rely on somebody that's just said to be able to go online for banking and everything else. And if we can't go online, then we're in trouble, you know?",0.41718936,0.4968545,1.0533993e-05,2.1587889e-08,0.0004472637,0.08549829
364,"Yes, family.",0.48900378,0.36701402,0.048220705,0.008754685,0.024652742,0.062354043
365,"Yeah, well, I've got my church family. So they would be called family.",0.6943486,0.20360246,0.0104352515,0.0013806327,0.023512615,0.066720456
366,"Yes, firends, family. so I guess family in the widest sense. Yes.",0.1719496,0.18464254,0.005657718,0.0019170201,0.06850467,0.56732845
367,"Yes, because you can choose your friends. Yes, yes. Friends can become family.",0.6842119,0.27724025,0.0027088278,0.0040720827,0.0021396696,0.02962728
368,People you are most close to,0.25294846,0.698595,0.0028289172,0.0024139527,0.015327089,0.027886586
369,"Yeah, I do. Laughs watching too much..",0.060259797,0.85408473,0.03089167,0.0024577263,0.03220145,0.020104622
370,"Yeah, I find it fabulous. There is  these quizzes and all that sort of things, and it keeps working on. Yeah. And everything else. I think that's the physical aspect of it.",0.23911078,0.4913572,0.0057386337,0.019643344,0.0050771125,0.23907292
371,"But like you said earlier, I think there's that sense of if you're in the house with no sound of any description or you feel lonely. Yeah, even if you've got the television on the radio or something, on the background, you don't notice the silence. You don't noticeit by yourself.",0.007855121,0.99044293,1.6662863e-08,5.0994e-10,2.6508038e-05,0.0016754083
372,"And I keep talking about my mother, for she likes to how, even though she can't see it, she likes to have the quizzes on. Yeah, you know, she watches the chase. Yeah. And what's the one before that, Tipping point? Yeah. And then so she can answer the questions yes, it keeps up the mind active. Even though she can't see it, she can hear it.",0.26002246,0.50210917,0.23324184,2.6167021e-05,0.0013343197,0.0032660216
373,"So we didn't really talk much about that kind of mental stimulation, did we? That is really important.",0.17884822,0.31995478,0.08411613,0.0026793994,0.06523204,0.34916943
374,"Yeah, because that could be depressing. When you can't get up and do things for yourself, like you used to",0.07657225,0.85624343,0.028809886,0.0008679032,0.0051072636,0.03239924
375,depression.,0.087389566,0.5531477,0.13256945,0.0052191573,0.042982437,0.17869172
376,If the people at church found out where I am.,0.22095951,0.5149274,0.003825831,0.0052058445,0.013580445,0.24150094
377,Facilitator.,0.034973525,0.3978832,0.026713494,0.015480708,0.50006497,0.024884094
378,"I think the other one, I think as you get older, you lose your confidence.",0.1321375,0.37298563,0.002300847,0.00090742134,0.032589067,0.45907953
